"id","created_at","reviewer","product_id","rating","body"
791,"2018-04-26 12:55:00.367","isac",140,4,"Maxime voluptatibus a quibusdam qui veritatis dolorem vitae. Quod et sequi maiores ut hic quo. Quibusdam voluptas officia eos omnis nihil iusto minima molestiae. Optio consequuntur maiores qui sed modi laudantium. Minus autem rerum non distinctio placeat possimus et."
792,"2018-08-22 14:26:16.524","erling.farrell",140,5,"Cumque quos et non ipsa ab quia cum. Voluptas beatae cumque maxime eius et aut vitae perspiciatis. Odio qui dolorem distinctio perferendis. Esse ipsa tenetur odit nostrum."
793,"2018-08-11 22:00:18.405","estella-padberg",140,4,"Ad explicabo voluptas dolores. Nemo tempora sapiente quos soluta error. Dolorem nisi tempore culpa. Omnis quo maxime et nostrum doloribus numquam nihil vitae. Adipisci eum laborum quam dolorem qui vitae sint repellat."
794,"2020-03-24 03:16:29.159","brown.olson",140,4,"Minima tenetur hic facere sint ratione earum. Voluptatem iusto accusamus fugiat facilis libero nihil quae. Optio voluptas enim est iusto error hic occaecati."
795,"2019-10-08 00:56:58.156","della",141,4,"Optio quae sed ducimus commodi et dolor eos ipsa. Laborum ratione aut ea iure quasi. Et sed tempore eos eos animi ipsam. Temporibus aperiam sunt aut."
796,"2019-07-28 07:07:27.047","casimer-orn",141,4,"Asperiores minima vel molestiae est autem fugiat. Fuga omnis earum qui saepe minima molestiae temporibus dolorum. Earum sunt laboriosam tenetur cumque dolorem illum atque."
828,"2020-03-19 09:51:36.898","delia",148,3,"Quia in molestiae consequuntur. Iure recusandae ipsum et veritatis odio. Excepturi porro neque aliquid. Itaque dolorem optio molestiae ratione voluptatibus in fugit."
797,"2019-01-17 19:37:40.23","magdalena.kunde",141,2,"Rem et autem voluptas dolor quas inventore aut dolore. Aperiam dolor nisi voluptas voluptate repellendus corrupti. Dignissimos facilis sapiente voluptatem dolor. Inventore error delectus eius ducimus. Qui praesentium accusamus harum."
798,"2019-11-09 20:47:43.656","dina",141,4,"Soluta excepturi delectus et sunt sunt. Aliquam molestias quod voluptas animi. Incidunt voluptatibus et nihil corrupti aliquam nihil. Quo aut ea fugiat laudantium amet repellat. Sint quis ut sed libero ab ad repellendus ut."
799,"2019-12-28 02:42:33.79","koby.armstrong",141,5,"Autem non qui eum dolores aspernatur. Sunt ducimus libero sunt laboriosam saepe rem. Nostrum quia temporibus iure vel deleniti voluptatem. Mollitia pariatur corporis aliquam. Molestiae itaque corrupti repudiandae aliquam voluptatem hic."
800,"2018-11-01 11:10:34.65","jerrold.rowe",141,4,"Et non omnis error iure odit amet. Voluptas velit sint labore qui sit dolor veritatis perspiciatis. Animi sit repudiandae quia dicta in."
801,"2019-10-29 15:14:37.381","ernestina",141,4,"Ab sit laboriosam eveniet provident. Quisquam minus molestiae voluptate. Odio quisquam omnis quasi neque facere."
802,"2019-05-30 05:37:52.585","noah-erdman",141,4,"Sunt aliquid autem et necessitatibus neque nam facilis nostrum. Totam nemo laboriosam voluptatum inventore explicabo deleniti. Eius veniam sed voluptatibus qui qui. Pariatur delectus modi eum incidunt."
803,"2019-06-09 01:26:47.466","cleta.powlowski",141,4,"Dicta illo amet et voluptas autem repellat voluptatibus. Amet et nihil molestiae deleniti tempora. Est et molestiae et assumenda dolore numquam rerum sint. Pariatur maiores delectus impedit. Minus soluta aut ut a tenetur rem similique."
804,"2018-12-06 01:17:14.014","otto.schaden",141,5,"Et fuga at nam. Eius et architecto magnam fugit deserunt inventore recusandae. Dolorum sed neque ullam eius cupiditate cupiditate."
805,"2017-11-13 23:34:10.992","franco",142,4,"Ad reiciendis eligendi error nisi laudantium nobis atque. Quo perspiciatis rem eum ut non reiciendis non est. Culpa non rerum itaque ab corporis nemo. Voluptatem cum atque iste sed corrupti itaque."
806,"2018-06-23 04:28:15.428","brad",142,4,"Voluptatem voluptas quia reprehenderit voluptates sunt voluptatum suscipit illum. Voluptate voluptatem sed culpa maxime nostrum sed et eum. Ipsum ipsa culpa omnis quo. Quo rem non harum."
807,"2019-12-06 13:40:53.636","estevan",142,4,"Nobis quisquam aut et consequuntur et quia totam fuga. Laudantium nostrum suscipit et est omnis est accusamus. Cum amet magnam maiores ut sunt aut ut dolore. Asperiores eum ut et perspiciatis."
808,"2018-02-27 14:47:50.313","friedrich",142,5,"Aut voluptas nostrum nulla ea vero mollitia vero inventore. Minus dolores dignissimos rerum et dicta necessitatibus voluptatem explicabo. Cumque deleniti minus harum."
809,"2018-09-01 10:16:58.752","haven.morar",142,5,"In voluptatibus voluptas praesentium exercitationem. Et architecto omnis aspernatur. Et reprehenderit quidem magni itaque earum. Voluptatem qui earum qui rem et."
810,"2018-06-10 05:46:59.282","blanca",142,5,"Quo aliquid perspiciatis et dolorem. Laborum quasi ducimus sapiente enim est ratione aut quidem. Nihil et autem suscipit. Non nulla tenetur ut. Commodi quas consectetur id et incidunt repellat quia."
811,"2019-04-07 00:08:00.539","chanelle-marquardt",142,5,"Minima rerum est inventore architecto voluptas quisquam unde omnis. Aut esse et dolore. Quo soluta et repellat et iure."
812,"2018-09-13 02:37:59.264","anahi-reichert",142,3,"A occaecati consequatur sit ab quia dolor. Rem est laudantium qui nisi perspiciatis inventore porro. Velit eos praesentium sequi et. Repellendus ut debitis qui magnam perferendis et totam."
813,"2019-08-27 04:22:16.418","joanie",145,5,"Sit eum optio molestiae debitis dolorem. Ducimus quia temporibus quod aut eos eos et. Soluta aut voluptatem quia fugit sit. Ut necessitatibus eos molestias sequi."
814,"2019-03-29 00:51:08.006","delfina",145,5,"Velit est laborum beatae eius fugiat. Ut incidunt voluptas ad quae. Enim iusto et dolorem rerum. Unde atque voluptatem deserunt sunt dolorem. Sunt dolores maxime nesciunt."
815,"2019-06-03 11:50:53.443","rosella-huel",145,5,"Iste fuga deserunt unde est sed sint et aspernatur. Sapiente corrupti nihil sint consectetur quae doloremque at. Atque iusto eligendi magnam sunt optio. Ipsam iusto quo consequuntur. Officia odio sunt ad in sapiente mollitia."
816,"2020-01-10 21:05:37.619","gino",145,2,"Totam enim quia vel ipsa voluptatem ex tempore molestiae. Placeat rerum quos maiores quia accusamus est. Id qui nihil omnis ut adipisci magni. Saepe eius dolor at."
817,"2018-07-20 13:22:59.751","jackeline.spencer",145,5,"Corporis harum temporibus voluptatem alias. Perferendis qui ut mollitia. Et quaerat est illum. Architecto qui ratione quia et ut est."
818,"2017-10-24 13:17:27.841","vidal-satterfield",146,4,"Totam impedit modi reprehenderit eius vel ad. Ea consequatur aut aut et dolore placeat iste. Odio perspiciatis voluptates quis optio doloremque omnis vel voluptatem."
819,"2016-11-14 03:44:05.51","elisha",146,5,"Voluptatem dolorum sed est rem optio esse aperiam. Ullam voluptas voluptatibus reprehenderit ducimus. Laboriosam maiores id dolore et a."
820,"2017-08-01 04:48:37.536","christine.kirlin",146,4,"Eligendi perferendis aut adipisci impedit autem. Repellendus asperiores cupiditate quam sint eum ipsum sit. Animi sed et dicta hic maiores quis vel. Eligendi aliquid porro totam nostrum distinctio voluptates."
821,"2018-05-17 07:35:07.227","daphnee",147,5,"Qui voluptatem ab quis sit labore. Non sed minima deserunt sequi soluta eum. Aliquid et dolor voluptatem sint voluptatem corporis mollitia. Libero consequatur officiis consequatur suscipit eaque qui accusamus. Maxime tempore maxime voluptatibus."
822,"2019-10-14 22:27:07.156","elva-bartell",147,5,"Omnis voluptatem reiciendis non debitis. Accusamus optio porro ipsam ut rerum reprehenderit veniam quaerat. Aut vero laborum non id vel recusandae sapiente voluptatem. Officiis sunt exercitationem a."
823,"2017-09-23 06:52:23.169","clifford",147,4,"Rerum officiis tempore suscipit voluptatem tempore deleniti. Debitis sunt est molestiae. Eum tenetur praesentium animi in voluptatem rem. Corrupti cupiditate iure aspernatur sunt et sed omnis adipisci. Modi tempora voluptas explicabo molestiae voluptatum."
824,"2019-08-15 09:50:29.338","otho.ondricka",147,5,"Voluptas ipsum ipsam hic et. Ab doloribus dolorem ratione officia delectus. Fuga et et velit aut optio tempora. Qui atque sed dignissimos rerum. Sit est qui non blanditiis voluptas ut explicabo."
825,"2017-11-14 01:43:22.996","esteban",147,5,"Qui autem aspernatur et rerum ea optio voluptatem. Maxime ut voluptate fugit deleniti. Aspernatur commodi qui sit iste nisi nulla. Laborum voluptatibus aut quo. Veritatis est rerum rerum ab."
826,"2018-09-03 02:13:18.313","barrett-raynor",147,4,"Quae atque aut fuga consequatur. Placeat consequatur distinctio quidem animi dolorem ut hic pariatur. Voluptatem accusamus perferendis dolorum non quia quis quia dolores. Aut placeat ut amet adipisci. Optio unde unde sunt."
827,"2019-04-28 22:45:01.724","fleta",148,4,"Soluta perferendis vel nihil consectetur sed dolor ab quo. Et recusandae ut ipsam non ullam. Minima voluptas doloremque non."
829,"2018-11-16 08:37:40.003","delfina",148,5,"Sunt ratione et pariatur optio omnis. Nesciunt omnis quisquam est dolorem maxime cum. Qui modi consequatur sed facere nobis ut aspernatur vitae. Autem reprehenderit dolorem iste impedit."
830,"2019-07-22 01:09:30.273","hobart-lueilwitz",148,4,"Soluta voluptatum est temporibus voluptate. Sit doloremque assumenda dolore architecto vel magni non. Voluptas aut officiis inventore."
831,"2020-04-06 14:49:46.113","isaiah.schimmel",148,4,"Odit eos voluptatem inventore eius eveniet. Fuga expedita voluptatem sint rerum voluptatum. Itaque dolorem iste et. Illo blanditiis commodi quia in asperiores. Quia minus reprehenderit et natus."
832,"2020-03-10 18:44:54.021","cecil-trantow",148,4,"Vero odit quam id laborum. Ea rerum omnis blanditiis nostrum quibusdam minima non omnis. Quis est rerum quibusdam libero."
833,"2020-02-14 02:20:07.171","marjorie-kuhic",148,5,"Illo nisi ea magnam nemo qui modi. Et libero tempore ipsam accusamus eaque. Incidunt vel dignissimos natus alias natus est eius ut. Voluptate dolorem quia consequatur unde quis autem laboriosam non. Tempora animi eius ex eveniet error ipsum."
834,"2018-11-17 07:33:33.854","kelley.wisozk",148,4,"Enim facere amet aperiam iure. Corporis velit in voluptas aliquam autem aut quia. Qui exercitationem praesentium iste aspernatur velit est. Perferendis sed illo culpa non. Consequuntur quibusdam excepturi quae."
835,"2019-09-16 00:24:31.256","paula",148,4,"Eaque est dolorem beatae nesciunt voluptatum. Ea magni vitae dolor ad qui qui. Officiis voluptas deserunt in iste eligendi consequatur qui. Ut suscipit ipsam dignissimos qui."
836,"2020-04-18 06:06:38.829","daron.thiel",149,4,"Vero cupiditate temporibus molestiae fugiat. Et atque omnis consequatur mollitia dolore. Pariatur sint dolorem excepturi aut rerum molestiae qui et. Quas corporis illum nam sed. In id fugit eius et velit illo velit."
837,"2017-08-24 20:00:12.071","king-hickle",149,5,"Non magnam voluptate voluptatem molestiae ducimus. Sed quaerat dignissimos voluptatem tenetur maxime officiis. Sit ipsam nihil doloribus velit occaecati et rerum sit. Qui numquam eos placeat temporibus unde culpa fugiat."
838,"2018-09-11 05:20:24.494","lewis",149,4,"Similique inventore distinctio iusto. Tempora voluptas vel aut dolorem. Totam doloremque incidunt ut atque quam enim nisi cum."
839,"2019-07-04 13:15:30.623","stuart",149,5,"Eum ipsum eius excepturi inventore eveniet voluptatem quidem in. Qui facere occaecati et ex possimus. Quia ipsa reiciendis sit tenetur incidunt. Voluptas unde et ut dolores reiciendis sapiente ad labore. Sit ipsa accusantium praesentium voluptates."
840,"2019-03-05 05:48:31.103","jillian",149,4,"Ullam est officiis quia numquam quisquam amet. Aut incidunt soluta ut est ex. Et in cum in."
841,"2020-04-09 20:59:44.823","alysa",149,5,"Aspernatur eius ut autem architecto magnam rerum. Nemo nesciunt quas rerum dolorem ea. Perferendis voluptatem ipsum aut maiores molestiae."
842,"2017-08-16 19:49:29.676","rene-morissette",149,5,"Quibusdam distinctio quaerat eos quas omnis. Molestiae officia impedit ducimus sapiente sit. Maiores consequatur eius consequatur quod magnam. Sunt labore eos quia sint quo."
843,"2018-11-09 03:50:34.912","bailey.schaefer",149,4,"Et asperiores consequuntur nihil similique laborum. Voluptas odit minus et laudantium deleniti qui sapiente. Voluptatem vitae quisquam et architecto facilis consequatur aut. Nemo quia nisi doloribus saepe. Animi tempore non alias."
844,"2018-08-17 17:47:24.153","wava",149,4,"Tempore incidunt cupiditate aut enim eius nam. Aut quas nulla adipisci. Ullam et praesentium non iusto nihil consequatur. Et dolor est qui id."
845,"2018-03-14 19:27:17.28","jannie.mann",149,4,"Aut accusamus esse aut ducimus nesciunt. Id iste repellendus eos provident ut quas deserunt. Quod odio perferendis aliquid aut."
846,"2018-02-07 18:48:06.071","breanna.reichel",149,2,"Debitis quas est molestiae est. Ut hic iusto tempore laudantium id fugiat. Nesciunt non nobis et dolor voluptate inventore est."
847,"2019-08-23 04:25:36.528","avery.stokes",150,2,"Quam error sit laborum sint quod excepturi aut. Alias qui veniam impedit ut accusamus voluptatibus itaque quas. Odio sed necessitatibus quas impedit."
848,"2019-10-13 17:47:09.51","lexus",150,5,"Earum iste voluptates expedita culpa. Autem sint mollitia illum provident aliquid. Quo qui sed distinctio sunt odit exercitationem qui. Beatae dignissimos ex ea. Dolorum quo dolorem unde facilis."
849,"2020-01-03 18:39:41.561","emelia.luettgen",150,2,"Consequatur sint pariatur nihil id fugiat et repellendus omnis. Et asperiores dignissimos corrupti voluptas amet similique. Molestiae enim soluta qui voluptatibus velit."
850,"2019-12-02 18:28:05.034","francisca.mckenzie",150,5,"Illum laudantium molestiae harum ut. Omnis quas rerum consequatur ut. Dolor soluta aut eligendi nihil deleniti delectus."
851,"2019-06-17 06:30:56.999","kelsi-koepp",150,5,"Quaerat sed sequi odio alias in voluptatum non tenetur. Quidem molestias quasi voluptas. Quod aut illum reprehenderit asperiores."
852,"2020-02-11 20:07:44.552","jovany-bogan",150,2,"Vitae atque sed itaque ratione atque unde voluptatem perferendis. Ad omnis provident debitis ut quibusdam. Veniam quam aliquam commodi voluptas quia corrupti. Id laboriosam corrupti et."
853,"2018-12-13 03:04:50.454","jennie",150,5,"Quo ratione accusamus enim. Repellendus sed beatae odit ut cumque in deserunt. Dolorem illo vel nulla voluptate voluptatem provident. Eos aliquid ipsa dicta sint dignissimos ab."
854,"2019-10-30 17:11:20.818","tyrell",150,4,"Vitae aperiam deserunt delectus. A corporis magni non quasi harum voluptates praesentium ut. Harum illo eveniet deleniti. Modi qui a quisquam. Rerum temporibus doloribus et est velit temporibus ut."
855,"2020-02-07 01:04:52.378","gladys.reinger",150,4,"Quia assumenda quae et harum dolorem iusto. Animi a assumenda est distinctio tenetur. Ad reprehenderit accusantium provident libero. Consequatur consequatur mollitia nemo voluptas iste tempore."
856,"2019-10-27 23:16:09.933","micaela",150,5,"Eos fugit quas at repellendus in. Perspiciatis quidem sed aut dolore qui recusandae quia. Non et libero quisquam odio earum."
857,"2019-04-16 11:15:44.715","amir",150,4,"Quos omnis nam aut blanditiis consectetur esse facere. Reiciendis enim sit eum. Assumenda possimus iusto eum dignissimos laudantium. Ea vitae autem excepturi iure culpa deleniti accusantium. Sequi qui illo cumque."
858,"2019-03-17 15:02:15.615","donnie.vonrueden",150,4,"Voluptas magni velit quo perspiciatis reprehenderit. Illo quia et quod rem qui. Sit cupiditate unde quos eligendi est."
859,"2019-05-01 14:53:39.589","darren.jacobi",150,4,"Est reiciendis dolor voluptatem voluptas magni suscipit. Facere sint quos eligendi libero impedit ut. Ipsa ratione velit voluptatem. Laboriosam ipsa qui officia accusamus. Aut vel error reiciendis facere voluptatum eaque atque."
860,"2019-11-12 11:33:52.647","gay.bartell",151,4,"Accusantium adipisci dolorem impedit quibusdam amet voluptas minima. Iure consequuntur est dolorum quos iste natus repellat. Commodi dolores sed repellendus."
861,"2019-09-19 16:04:54.892","elmer",151,4,"Assumenda error suscipit ut sint aperiam quasi. Qui error officia dolor consequatur laboriosam. Sed ut culpa consequatur voluptate aut."
863,"2019-12-07 05:57:11.761","darius",151,5,"Enim ipsam est dolorum accusamus est est. Alias qui eos temporibus et impedit aut quo. Quo suscipit velit in aperiam dolores nihil ut. Tempore voluptate nostrum autem ut."
864,"2020-01-07 06:09:57.009","katherine",151,4,"Qui voluptas et iure aut voluptates nihil commodi. Repellendus optio magnam quisquam sed quod impedit ipsam. Quis nihil quos occaecati. Voluptate vel est quis dolorem libero laborum voluptatem architecto. Et sunt libero quia."
865,"2020-01-17 00:40:09.634","angie.anderson",151,5,"Cumque quia sit architecto dolore temporibus sint et. Eos aliquid consequatur in et. Iste cum cupiditate minima. Quia magni voluptatum sunt aut. Sapiente aut facere voluptas qui alias ut sit accusamus."
866,"2018-01-27 07:36:05.08","jimmy.huel",151,3,"Fugiat cumque consequatur voluptas eligendi temporibus. Cumque culpa architecto nobis aut temporibus. Unde nemo dolorem aut saepe quisquam."
867,"2019-02-02 17:30:36.543","ellie",151,4,"Qui eligendi delectus recusandae voluptate deserunt consectetur. Quidem nostrum cumque placeat et. Occaecati error mollitia atque ut nihil quis. Maxime aut quis maiores fugit aliquam laborum expedita."
868,"2019-08-29 14:08:05.957","isabel-vandervort",151,5,"Eligendi enim non qui. Qui earum ab maxime quo. Molestiae adipisci culpa harum accusantium enim corrupti. Sapiente ut voluptas quo odio fugit culpa."
869,"2019-10-16 08:25:35.486","kris-kling",151,4,"Ut nobis et nobis quas tenetur sed vitae. Aspernatur dolor occaecati magni ea alias magni est sapiente. Unde tenetur aliquid aut iusto."
870,"2018-01-31 18:03:14.725","emilie",151,4,"Consequuntur exercitationem rerum vel aut adipisci laboriosam. Ea non voluptatibus quisquam voluptatum. Numquam eligendi numquam sint. Aut facere eaque eveniet vel pariatur veniam. Et hic deserunt qui consectetur sed est vero."
871,"2018-04-10 23:28:57.211","wanda",151,4,"Cumque sed culpa hic. Commodi ducimus id sunt. Cumque molestiae nobis eaque sed. Voluptatem error quaerat similique omnis. Ut natus voluptas delectus ipsum quod eum neque."
872,"2018-12-06 00:09:22.433","linwood-flatley",151,2,"Eos aut ut hic voluptas officia. Omnis perspiciatis recusandae quo quae amet aut. Dolore sapiente aliquam asperiores atque illo aliquam velit quod. Modi aliquam corrupti eaque porro assumenda facilis."
873,"2019-09-22 15:49:13.964","merritt",151,3,"Similique deserunt impedit est distinctio. Debitis fugiat iusto quis. Amet facere aut amet quo. Tempora dolores animi sed provident."
874,"2019-12-07 21:13:27.566","randall.towne",152,5,"Est commodi aut porro. Quasi sit et soluta et deleniti officiis. Earum corporis saepe eius ea qui nihil aut quisquam. Corporis et vel voluptatem voluptatem dolorem. Iste aut suscipit qui sit voluptas non ipsa accusamus."
875,"2018-07-13 18:58:15.266","vanessa.stoltenberg",152,2,"Voluptatem id quas quis rerum. Assumenda et exercitationem omnis corporis aperiam eum. Quia at non provident numquam ut ad. Possimus et iure dolorem a sit. Vitae ipsum voluptas mollitia velit debitis."
876,"2018-05-29 08:15:53.961","constance.king",152,1,"Nisi ut molestiae voluptatem ea. Doloremque aspernatur quas quae reprehenderit voluptatem eum id eos. Assumenda iusto dicta officia beatae fugiat. Voluptas vel distinctio explicabo aut facere ut voluptatem. Autem a voluptatem laborum asperiores quos quia."
877,"2017-06-11 14:38:15.097","katelin.windler",152,5,"Eius porro et natus. Debitis quod sapiente non. Id fuga ducimus eaque sint repudiandae velit. Eveniet ipsam quia corporis."
878,"2020-03-15 07:52:20.231","harold",152,5,"Rerum quos ipsum libero qui quidem quaerat nesciunt. Voluptas autem ut quae aliquid consectetur sit. Est tempora voluptas in est quod ad consectetur alias."
879,"2018-05-03 07:03:05.698","emanuel-rippin",153,5,"Veritatis vitae eos asperiores vel in numquam perferendis. Animi deserunt et numquam id consequatur et. Quod aut quisquam sapiente."
880,"2018-06-17 13:16:50.073","kacie",153,3,"Fugit nobis vel optio quos placeat atque non. Inventore accusamus et autem cumque. Autem nam id aliquid eveniet."
881,"2020-01-26 10:25:37.617","gunner",153,4,"Dolor sit distinctio eos qui nihil beatae nam aut. Molestiae voluptatem ut cumque itaque debitis esse. Quidem ad praesentium perferendis in. Earum numquam non sapiente. Minus eos non in commodi aut amet repellendus quibusdam."
882,"2018-03-25 09:49:55.437","laurine.leuschke",153,5,"Nisi et ut cum a et omnis vel. Id cumque sit odio voluptatum qui. Quia alias ut distinctio aut et. Ratione adipisci asperiores quisquam. Perspiciatis qui minima voluptas dolore minima illo illum."
883,"2019-04-08 13:13:39.829","abe.gorczany",153,5,"Quibusdam aut et et omnis in saepe et quod. Nostrum corrupti omnis quidem modi maxime. Quia est non aut excepturi dolorem. Soluta quia dolorem aut et dolor quam qui. Et impedit enim alias."
884,"2019-02-13 16:38:00.091","dion",153,4,"Voluptas nesciunt cum rerum quis et provident dolores. Laudantium omnis sit labore officia modi dolore. Illum dicta impedit quo quisquam in ut hic."
885,"2020-01-24 17:29:08.288","colt-tremblay",153,2,"Dolores iure error quaerat delectus. Nulla perferendis harum aut neque non perferendis quam occaecati. Quis ad totam molestiae atque tempora voluptatibus excepturi."
886,"2019-04-06 08:55:43.055","kassandra",153,4,"Doloribus sapiente voluptatum qui et perferendis. Sed vel sed voluptatibus debitis facilis enim. Sit dolorum quo velit. Optio labore molestiae quo velit explicabo provident quos consequatur. Commodi delectus incidunt ea optio reprehenderit."
887,"2019-09-24 05:30:51.387","joany",153,5,"Qui nisi dicta saepe quis ipsum officiis. Libero est officia est nulla doloribus et velit. Autem sit repudiandae magnam exercitationem voluptatem. Quia nostrum quis possimus veritatis voluptas. Id omnis officiis sapiente."
888,"2018-04-04 22:12:04.865","matteo-damore",153,5,"Amet sit illum incidunt dolores qui ducimus aut. Corporis dolores aperiam molestiae nostrum. Veniam nam voluptatem illo et unde. Architecto rem et quae culpa dolore fuga tenetur."
889,"2019-11-14 14:39:51.533","jackson",153,4,"Qui autem et quia enim est atque repudiandae. Excepturi eos quia ad voluptatum. Ipsam voluptas quo ex. Officiis et nemo aliquid et labore maiores nihil. Mollitia sapiente vitae eveniet ullam consequatur rem."
890,"2018-12-08 07:38:57.059","cullen",154,4,"Nihil quae saepe est repellendus natus rerum alias nulla. Quidem vero est facilis. Incidunt qui itaque eos exercitationem ut cumque fugiat aut. Eius nobis sint aliquam ratione omnis fugit nihil."
891,"2019-07-21 07:13:02.527","jonathan.okuneva",154,3,"Aspernatur enim exercitationem quibusdam ullam harum quo nam quam. Placeat hic dolor perspiciatis nesciunt. Eum ipsa vel ut. Minus amet id tenetur."
892,"2018-08-02 16:36:16.676","coy.fisher",154,4,"Asperiores necessitatibus occaecati possimus. Numquam odio voluptates consequatur accusantium autem quibusdam aut et. Omnis fuga rem quo id nesciunt corporis harum. Ut unde dolor dignissimos pariatur quia at sed labore."
893,"2019-06-02 12:01:31.237","keven",154,3,"Eveniet tempore magni provident laudantium nemo saepe maxime. Maxime ipsum error aut et enim quo autem. Maiores earum et ipsam maxime modi. Voluptatem expedita voluptate quibusdam eum quia quia enim."
894,"2020-02-28 18:52:41.327","quinn-rolfson",154,5,"Aliquid minus ut velit adipisci qui. Cupiditate voluptate natus error corrupti adipisci officiis qui. Harum qui porro odit rem aut deserunt officiis quo. Natus dolor cumque vitae."
895,"2018-11-09 13:33:19.93","miracle.mcglynn",154,5,"Nulla aut ullam reprehenderit minima non labore fuga accusantium. Non excepturi ut sunt aut. Pariatur qui cumque at vitae mollitia non officia."
896,"2020-02-28 02:36:21.359","maynard-baumbach",154,5,"Libero placeat iusto reprehenderit ut. Rerum laborum et culpa velit. Necessitatibus at dolorum recusandae. Ad atque dolor libero voluptas voluptatum aspernatur quidem necessitatibus. Dolor hic nostrum repellendus similique odit."
897,"2019-01-22 00:44:13.188","myrl",154,5,"Praesentium vel repudiandae natus repellendus exercitationem fugiat. Illo iste corporis doloribus error aut eos. Repudiandae qui eum et dolor sed. Est et veniam dolorem nostrum harum molestiae nihil libero."
898,"2019-08-14 11:58:30.688","marcus",154,4,"Necessitatibus minima non esse nisi aut suscipit. Iusto eum laudantium itaque ea sint cumque cupiditate omnis. Eligendi numquam aspernatur veritatis. Velit esse error animi in."
899,"2018-11-03 23:13:29.571","rico",154,4,"Reiciendis aut ad vero. Expedita fuga voluptates ut tenetur nostrum maiores eum. Velit rerum reiciendis mollitia eum. Enim quaerat reiciendis similique ratione et."
900,"2019-11-14 00:47:39.32","regan-windler",154,4,"Amet minima et cumque a numquam ut. Nemo impedit deleniti ut consequatur. Deleniti repudiandae a iusto aut distinctio doloribus. Ea eos alias eveniet quae iure. A aspernatur quasi dolores rem temporibus amet temporibus asperiores."
901,"2018-07-22 16:20:36.961","bernadette",154,3,"Aspernatur consectetur sint quisquam aut recusandae qui est. Adipisci vel velit est autem. Laudantium perferendis officia facilis inventore ullam blanditiis sint. Tenetur aut ea mollitia sunt explicabo repellendus et. Repellat cupiditate quaerat saepe iure eum et doloribus vel."
