"id","created_at","reviewer","product_id","rating","body"
457,"2019-03-14 06:25:28.364","florence",74,5,"Qui illo quae hic a est aperiam doloribus nobis. Esse asperiores qui itaque. Omnis voluptatibus ea dolorum."
458,"2019-02-09 02:50:29.603","delaney.reichert",74,4,"Ut quis qui ratione et. Enim omnis voluptates et dolores. Molestiae voluptates eius qui. Odit ea atque fugit non."
459,"2017-11-30 20:34:28.589","erwin-murazik",74,4,"Quo voluptatibus deserunt ad quo. Recusandae sint deleniti recusandae sunt et eos fugit est. Quasi numquam quasi et veniam rerum sed sint. Et soluta sed culpa quia."
460,"2017-11-03 21:02:05.488","aubrey-hermiston",74,2,"In esse minus beatae qui non rerum. In soluta alias dignissimos aut reiciendis voluptatem labore sed. Qui molestias enim rerum dolores ratione. Sit in est illo debitis libero doloremque."
461,"2017-04-09 09:12:54.462","javier-feest",74,5,"Rem rem aut dolor harum accusamus libero. Consequuntur porro dolorem velit tempora et tenetur provident molestiae. Cumque dignissimos voluptates ut sequi. Eum veritatis aut aut. Rem blanditiis et exercitationem temporibus quibusdam eveniet aut."
462,"2019-11-13 13:11:50.242","icie-lebsack",74,4,"Earum doloribus enim incidunt commodi. Quam ullam rerum rerum mollitia quia repellendus. Aut doloribus est quo est ex."
463,"2018-03-09 13:41:29.596","camille-schiller",75,4,"Tempore illo distinctio voluptatum optio vitae. In quas omnis cum ullam rerum consequuntur hic. Distinctio autem odit adipisci consectetur qui quis consequuntur rerum. Consequatur omnis numquam quasi aut cumque nesciunt. Error adipisci sunt possimus."
464,"2018-10-27 17:13:13.763","lisa.batz",75,5,"Quo beatae non quisquam aspernatur libero. Ab aspernatur eum rem voluptatibus nihil magni et veritatis. Nulla quia voluptate et quo autem."
465,"2019-03-04 22:35:14.822","raquel.reinger",75,4,"In explicabo nihil consequatur sapiente error omnis dolor et. Labore doloribus odio praesentium nihil odio modi et. Eaque repellendus possimus numquam."
466,"2019-12-12 02:49:16.279","antwan-ferry",75,5,"Non velit explicabo necessitatibus hic optio. Consequuntur ipsum consequatur non eveniet cumque. Eos ullam quia id eum quia et."
467,"2018-08-30 14:10:43.916","etha",76,3,"Aut nemo eaque asperiores ipsum voluptatem qui qui. Ex molestiae porro corporis occaecati placeat necessitatibus fugiat sapiente. Explicabo dolorem enim accusamus impedit voluptatum."
468,"2018-12-10 12:05:56.475","hailey",76,4,"Aliquam atque amet a. Possimus nostrum ut fugiat. Maxime commodi nulla aut aut eum nisi. Consequatur qui blanditiis delectus. Odio autem est culpa voluptatibus id et."
469,"2019-04-22 23:22:03.78","ruben",76,5,"Adipisci rem eveniet deleniti. Officiis quia animi voluptatem nemo. Placeat commodi dolorem quo asperiores id omnis. Quia commodi ea exercitationem temporibus ad. Sed ipsam impedit tempore et molestiae illum tenetur beatae."
470,"2018-11-21 04:24:40.202","lola-monahan",76,5,"Illo officia aut sit qui. Laboriosam quod eum voluptatem. Commodi error necessitatibus ut dolores aut et labore et. Alias nobis quam modi provident quis nostrum id nobis."
471,"2019-08-21 08:50:28.253","esmeralda",76,4,"Est soluta eius laudantium omnis. Consequatur non harum quia. Architecto non natus saepe voluptas cumque corporis sit."
472,"2018-09-01 20:02:26.346","dixie",76,5,"Distinctio explicabo exercitationem delectus eum. Quia possimus fuga voluptatem impedit sunt asperiores saepe quia. Numquam fuga ratione non consequuntur minus enim."
473,"2018-06-22 17:29:50.295","fannie",77,5,"Corrupti modi maiores assumenda corporis aliquid quis nihil iste. Exercitationem sunt ipsa voluptatem. Eius magnam soluta qui laudantium saepe fugit. Doloribus voluptas ut fugit quo ab qui animi."
474,"2020-03-18 21:56:27.811","dorothy-kuvalis",77,4,"Sed sit et et minima autem provident est accusamus. Porro debitis aut ea ut commodi quia eos. Reiciendis et est quam necessitatibus adipisci commodi voluptatem."
475,"2019-02-12 00:42:37.774","rachael.schamberger",77,4,"Asperiores et sed dolor magnam quis non. Aut consequatur eaque voluptatem sit sed unde sequi iste. Expedita quibusdam eveniet qui debitis maxime quia. Excepturi fugiat provident incidunt eius consequatur maxime."
476,"2020-03-24 21:50:56.929","scarlett",77,5,"Consequuntur omnis deserunt nam voluptatum alias delectus perspiciatis. Ipsum quia unde omnis et nostrum aut id. Omnis rerum dolores accusamus delectus a delectus hic quo."
477,"2018-07-24 01:32:30.852","garrison.yundt",77,4,"Voluptates architecto officia hic ex accusamus. Repellendus minima unde blanditiis odit. Omnis reprehenderit voluptas ipsa. Animi ipsum error aut velit qui quia id. Alias ipsa saepe accusamus libero."
478,"2018-07-31 11:13:01.577","kellie.hahn",79,3,"Ipsum culpa nihil et cumque blanditiis. Ex enim qui delectus vitae iste aut voluptatem ea. Rem tempora iusto commodi excepturi ab tempore quidem est. Optio aut qui voluptatem magnam dolorem similique harum."
479,"2019-02-27 09:39:48.18","ricky",79,5,"Quos ratione ullam ut. Est molestiae aspernatur ipsum ipsam non neque deserunt. Non nihil et cumque alias tempora."
480,"2020-02-12 16:57:12.533","makenna-berge",79,5,"Voluptate molestiae in ut autem. Aut et ut voluptas ut rerum nisi pariatur. Asperiores facere velit omnis sed."
481,"2018-01-15 11:26:42.418","alva-willms",80,2,"Eligendi assumenda earum repudiandae est tempora sit. Harum mollitia eum eligendi labore accusamus quo doloribus. Quia quos facere asperiores debitis reiciendis non quo. Et dolorem tempore expedita labore qui eos maiores."
482,"2020-04-11 16:27:31.177","ward-cole",80,4,"Veniam laudantium aut doloribus dolorum sint quod. Est error ipsam deserunt accusantium a omnis commodi. Voluptas ipsum doloremque illo praesentium adipisci libero. Voluptas error ea explicabo. Cupiditate sunt voluptate quia voluptas similique."
766,"2017-11-17 00:43:14.534","georgianna",136,5,"Quo magnam adipisci consequuntur. Maxime dolorem aspernatur quas. Enim quas at esse velit ut pariatur est."
483,"2017-01-07 12:34:20.093","norene-becker",80,4,"Asperiores corrupti sit accusamus numquam sit. Et provident provident ea repellendus. Temporibus omnis qui architecto magnam doloribus porro incidunt quia. Commodi quia dolores ut possimus tempora sed. Officiis et sint dolorum aut optio molestias esse."
484,"2018-11-05 06:13:09.141","marco-leffler",80,4,"Dicta molestiae in dolorem et qui adipisci ea totam. Sed sit quos omnis quod sit nesciunt ipsa. Eveniet mollitia ipsum et et cumque fuga ducimus. Fugit reiciendis necessitatibus ratione ullam ducimus illo et itaque. Quia et facilis placeat."
485,"2019-02-24 03:49:30.802","kailee-crooks",80,4,"Rerum quaerat qui illo qui nostrum. Natus est in autem nisi. Aliquam maiores tempora quia maiores quia similique. Nihil hic ut temporibus nihil quia."
486,"2017-11-06 21:02:46.764","joaquin",80,5,"Ducimus et omnis temporibus corporis omnis laborum ex. Dolores est sequi iure beatae minus doloribus dolores cupiditate. Ea nisi fuga mollitia error."
487,"2020-04-19 14:15:25.677","emely",80,5,"In pariatur eaque aut. Distinctio aperiam ut hic ullam officia provident quam. Veritatis possimus nesciunt cumque nihil hic quo."
488,"2016-10-02 13:29:34.575","larue.schultz",80,4,"Similique vel ipsam est corrupti dolorem ratione vero fuga. Ipsa sapiente voluptatibus fuga alias. Minima et quisquam non molestiae sed. Molestiae earum dolores dolor eius qui. In voluptatem odio architecto quidem eveniet quaerat et."
489,"2018-09-08 18:29:15.55","elliot",80,2,"Velit aut consectetur eum explicabo sapiente dolor. Ea deleniti cumque maxime debitis eaque aut. Inventore dolores eum magnam adipisci rem minus recusandae."
490,"2019-09-23 17:08:45.599","nels-hahn",81,5,"Cumque ipsam aut sunt rerum. Dolores ipsum quod veritatis fugiat voluptate velit placeat. Itaque ullam occaecati aliquam amet sed repudiandae veritatis sequi. Sed et accusantium ut."
491,"2019-06-17 07:07:39.326","buck-kertzmann",81,4,"Voluptatem expedita recusandae cum dicta id et. Sint error et necessitatibus delectus. Maiores nemo dolore accusamus quidem. Dolore nobis nihil odit voluptatem placeat doloremque. Magnam nam reiciendis molestiae."
492,"2017-06-05 05:03:04.397","alden-jones",81,4,"Ex autem ea quia ea praesentium aut iure magnam. Numquam nulla iusto sunt dolor eveniet ipsa quia a. Et optio blanditiis earum blanditiis sapiente sequi magni impedit. Possimus vitae voluptatum voluptas expedita deserunt voluptas. Sed quam sunt laudantium porro."
493,"2018-10-14 17:03:21.556","kailyn",81,4,"Animi ad laborum est explicabo aliquam quo error nulla. Est quae consectetur qui et earum delectus. Sunt est delectus nihil nihil id. Velit architecto id harum nihil quam."
494,"2016-12-06 11:19:17.751","naomi",82,4,"Omnis excepturi est ipsum voluptatem consectetur rerum. Est qui ea dolorem laboriosam quisquam in. Nisi quo ut explicabo assumenda."
495,"2018-10-25 13:46:41.617","era.collins",82,5,"Earum dolorum sequi sit aspernatur omnis laboriosam quia ea. Aut dolorum accusantium doloribus pariatur hic porro tempore id. Aliquid ut dolorum ullam reprehenderit quia ea dignissimos molestiae. Perferendis rem aperiam est quam quia magnam."
496,"2018-05-14 11:10:45.028","nicolette-cartwright",83,2,"Commodi neque cum ut enim impedit accusamus. Et est ipsam quia itaque exercitationem illo. Consequatur tenetur necessitatibus delectus accusamus. Voluptatem iure quae incidunt neque. Veniam officiis est et occaecati qui enim quasi distinctio."
497,"2018-11-30 15:24:35.155","madisyn",83,4,"Possimus eius tempora et ut dolor rerum qui deleniti. Tempore quam neque alias aut possimus quia ipsa laborum. Debitis pariatur quidem quia velit. Sint itaque est repudiandae libero dicta atque a et."
498,"2019-01-08 02:42:24.775","loyce.haley",83,5,"Vel consequatur deserunt sint. Voluptas voluptatem et itaque dolorem maiores voluptatibus. Repellat non nam repellat maiores tenetur nisi sed sit. Est dolore unde omnis voluptatibus sint est."
499,"2019-07-29 08:08:41.298","terry.hickle",83,4,"Est est soluta assumenda et et voluptatem culpa eligendi. Quod et soluta impedit. At voluptatem doloribus eius ut veniam. Quo consequatur vel quaerat assumenda eos dolorum iure. Aspernatur ipsam esse nostrum velit."
500,"2017-05-07 10:25:51.738","jerrod",84,2,"Ea unde ut dicta odio placeat. Animi accusamus vel cupiditate nulla. Exercitationem omnis ut ex iste dolores id repellendus aut."
501,"2017-10-04 06:56:34.617","lennie",84,1,"Ut quia ea sint aut inventore accusantium. Vitae explicabo est aut pariatur dolor cupiditate. Ut aut et ad dolor quam quia sapiente eos. Sint non optio sunt aspernatur qui ut voluptatem quis."
502,"2019-12-23 08:32:31.865","heath",84,4,"Incidunt veritatis aut est est. Ea cumque porro qui id dignissimos facere hic quae. Cum sint quo et beatae eveniet quia dolor."
503,"2019-10-18 05:54:40.546","deangelo.nolan",84,5,"Unde explicabo maxime odio. Nihil magnam quisquam possimus accusantium optio. Accusantium enim non alias rem optio. Voluptas molestiae quas est. Est deserunt ea odit."
504,"2018-06-28 15:02:15.457","drake",84,4,"Tenetur commodi placeat quo accusamus est qui fugit vel. Ut expedita sed quis. Id ut sit molestias dolores aperiam dolore. Velit saepe quis sequi quaerat voluptatem ad in."
505,"2017-08-18 01:15:42.651","judah",85,5,"Tempore aut consequatur cum accusantium dolores et molestiae cumque. Libero ab aut deserunt voluptates quisquam placeat aliquid. Assumenda corporis quis quasi illo nam consequatur nesciunt tempore. Natus sit molestiae nostrum distinctio est dolor quam facilis. Labore voluptates non ea incidunt deserunt porro."
506,"2017-06-15 01:00:37.242","natasha",85,5,"Sint aspernatur amet omnis et iste aliquam. Optio itaque porro sint tempore. Dolore provident dolor qui. Repudiandae omnis eaque in."
507,"2019-02-11 08:38:50.931","kellie",85,3,"Ratione est est suscipit eaque sed neque. Quam doloremque incidunt ea quam est veritatis mollitia minima. Praesentium voluptatum sit autem eos fuga provident. Ut dignissimos itaque omnis."
508,"2017-05-02 22:44:22.047","destinee-pfannerstill",85,5,"Non consequatur sint expedita laudantium. Minus porro aliquid qui quia unde. Quis vitae dolor dolore optio. Nam asperiores neque minima molestiae vel quia maiores. Magni voluptatem est amet et."
509,"2018-02-19 09:11:20.935","sigurd.ortiz",85,2,"Molestias et sit reprehenderit quo harum voluptate adipisci aut. Voluptatibus sint optio et. Aut doloremque officia sunt provident aut nesciunt. Dolor qui aut rerum magnam."
510,"2017-11-10 04:05:52.789","zola.gusikowski",85,4,"Ad maiores optio eum dignissimos. Magni repellat nobis culpa qui qui. Commodi et hic exercitationem corrupti sunt molestias omnis. Molestias nam dolore maxime molestiae. Temporibus quo quia modi sed blanditiis tenetur suscipit error."
511,"2017-12-24 16:59:48.526","darren.gislason",85,4,"Dicta nobis ea quibusdam eos deserunt. Nihil non incidunt excepturi omnis omnis et soluta rerum. Fugit dicta et consequuntur adipisci. Delectus laborum est nihil quia quia consequatur quis facilis."
512,"2019-03-25 06:07:24.614","loy.koepp",85,5,"Sit non mollitia impedit quaerat. Ea qui ea natus pariatur similique qui amet. Velit consequatur tempore sit. Ab sint atque nesciunt eos minus accusantium. Sint totam possimus unde."
513,"2019-04-07 14:46:21.951","rosa.kuhn",86,5,"Ut et quam sint voluptatem quidem consequuntur quo. Quaerat aut ut molestiae ut minus cupiditate quos maxime. Quia ex in quisquam sunt et omnis ut inventore."
514,"2020-01-29 21:35:22.94","jayde.padberg",86,4,"Eum quis omnis ullam adipisci voluptate vel id. Doloribus eaque eum odit aut sit voluptates et nemo. Et aliquid et reiciendis aperiam sunt enim."
515,"2020-03-03 19:51:23.058","jaylen",86,2,"Error ex unde facilis sunt beatae consequatur. Voluptate exercitationem omnis sint. Voluptas sed et mollitia reprehenderit sit repellat explicabo esse. Atque quam qui illum illum cupiditate."
516,"2019-09-21 07:29:01.184","ruth",86,4,"Possimus eius quam voluptas nesciunt. Minus debitis perspiciatis eaque facilis commodi sed. Sunt harum quia quia et reprehenderit culpa. Consequatur vel est ex doloribus qui magni impedit porro."
517,"2019-11-04 06:33:55.181","zella",86,2,"Sunt illo cum consequuntur. Dignissimos eius rerum deleniti. Fugiat omnis est quos. Et ut tenetur praesentium perspiciatis. Et cupiditate magni perspiciatis facere atque ab qui earum."
518,"2019-07-27 01:29:05.662","arlene.crist",86,5,"Eos quaerat aut optio fugit nisi ea maiores. Itaque inventore iste et reprehenderit odit illo. Odio nostrum et molestias dolor est accusamus sint eos. Sequi omnis alias vero."
519,"2020-01-12 10:57:11.276","horace",86,4,"Ut modi iure voluptatem aspernatur veritatis sit. Saepe dignissimos nemo sunt. Et enim sapiente quidem rerum repellat delectus aut. Consequatur dolorem aut culpa in accusamus porro veritatis."
520,"2018-10-13 00:36:21.715","oran",87,1,"Fugiat cumque accusamus debitis qui ipsam veniam natus voluptates. Inventore quas unde minus suscipit quod. Tenetur minima et dolorem harum sunt fuga non."
521,"2020-04-15 19:00:51.194","arnulfo-wunsch",87,5,"Repudiandae voluptatem necessitatibus ipsa dolorum est est eligendi. Sequi dolores voluptatem consequatur. Porro quasi consequatur autem. Nihil reprehenderit et est sunt consequatur id fuga. Quas accusantium sit dolorem nam."
522,"2019-01-31 11:35:07.427","carolina.wilderman",87,4,"Accusantium laboriosam eveniet iusto consectetur. Qui et quod reiciendis et modi perferendis voluptatem. Velit est ea blanditiis. Iure quia quia hic et quas."
523,"2018-06-24 08:55:15.545","jane.miller",87,5,"Quo sit itaque est in vero animi occaecati tempora. Laborum ut iste consequatur dicta eaque. Iusto est aperiam voluptas qui deserunt. Ea rerum non dolorem aut qui sunt dolore ex."
524,"2018-08-11 07:53:52.507","alejandra",87,5,"Illo tempora voluptas laborum. Sequi possimus et eaque qui blanditiis consectetur. Expedita sed soluta nisi optio aut ullam."
525,"2019-11-13 05:24:16.372","aniyah.hoeger",87,5,"Id at distinctio sint. Nulla similique pariatur vero libero. Vitae id eius doloribus. Molestiae suscipit provident exercitationem deleniti atque explicabo exercitationem."
526,"2019-10-18 12:19:58.585","addison",87,5,"Consequatur placeat alias occaecati iusto aliquid sint. Est sunt quas provident aliquid consectetur dolores quidem est. Velit quaerat et et reprehenderit inventore nihil atque. Suscipit consequatur consectetur est aliquam."
527,"2018-07-09 23:35:50.761","adalberto",87,4,"Quia similique qui pariatur necessitatibus molestiae voluptatibus consequatur. Dolores omnis delectus omnis quidem eaque ea iste animi. Dignissimos consequatur atque quo ratione ad. Doloremque beatae qui eius est dolore est sint quos. Tempora architecto sunt excepturi dolores."
528,"2018-09-07 01:55:41.948","vella.schulist",87,1,"Aperiam voluptatem consequuntur dolores qui aspernatur est culpa. Harum ut odio modi recusandae quam. Sed non sint voluptatum ut dignissimos est et molestias. Maxime voluptas iure et est placeat."
529,"2018-12-27 06:59:29.062","sibyl",87,2,"Delectus reiciendis quam quae inventore veniam qui. Expedita amet doloribus aut adipisci occaecati. Et dolorem inventore molestias. Iure fuga omnis omnis ut quae accusantium nisi est. Nostrum vitae et et omnis aliquam expedita inventore."
530,"2019-02-05 11:32:14.066","gage.goyette",87,4,"Consequatur et est enim porro qui incidunt. Porro nisi maiores ducimus officia nisi accusantium. Iusto et molestias voluptatibus quia. A ut cum nemo illo."
531,"2018-10-31 08:19:45.376","jacklyn-bartoletti",87,5,"Fugit adipisci ipsa optio veniam laboriosam nesciunt fuga est. Autem eos ex eveniet et iusto doloribus. Nostrum vero id id labore eligendi non voluptatem odio."
532,"2018-12-21 09:04:11.215","cassidy",87,1,"Rem quis et ipsum aperiam ad consequatur consequatur in. Excepturi voluptatem consequatur necessitatibus. Quia nostrum tempora ab molestiae consequatur officiis. Sapiente sunt velit eum veniam aut."
533,"2020-03-04 02:15:57.267","serena-lind",87,4,"Quos odit soluta omnis qui atque doloremque ex commodi. Ad alias quidem quis fugit quos ea veritatis ut. Labore amet cum numquam deserunt aut odit odit qui."
534,"2019-06-30 13:34:49.662","eda",87,2,"Suscipit vel quasi quis laudantium vel laudantium similique. Ab autem eum iure placeat quo voluptatem aut. Sint nobis mollitia consectetur ut ut illo nostrum. Explicabo nostrum a laboriosam quaerat."
535,"2020-01-27 02:09:40.918","casimer",87,4,"Provident repudiandae consectetur ut. Est sunt impedit ducimus totam. Eius dolor sapiente et aut hic. Et placeat nobis ipsa et. Est nesciunt necessitatibus itaque et dolorem iusto."
536,"2019-01-18 21:19:39.082","enos",88,1,"Nam architecto totam qui ullam maiores est aut. Qui fugiat quidem itaque corporis. Fugit aut provident ea fugiat ex repellat."
537,"2020-02-09 06:43:48.364","brisa-schimmel",88,4,"Consequatur optio sit libero est odit eveniet. Et placeat et quisquam. Aliquid consequatur modi modi ut. Enim sunt dignissimos tempore. Velit necessitatibus assumenda blanditiis est reprehenderit nostrum."
538,"2020-01-29 07:19:43.287","emil",88,5,"Mollitia sed quo illum non sit id sunt non. Tenetur et sed nobis hic. Et accusamus et voluptates rerum amet autem. Omnis non non enim laboriosam. Repellendus nihil quis qui dignissimos fugit."
539,"2019-10-08 01:45:54.158","oscar",88,4,"Iste vel eum voluptatem sequi aut. Exercitationem qui rerum aut modi. Dolor maxime dolores eius dolor laboriosam et sunt."
540,"2020-03-11 22:29:08.802","jamarcus-bechtelar",88,4,"Qui ut quo temporibus quis totam. Assumenda ratione nisi facere modi qui. Expedita qui praesentium ullam vero. Omnis illum possimus cupiditate perspiciatis delectus est. Aliquid velit mollitia cumque consectetur."
541,"2017-03-13 11:29:11.466","deangelo",89,2,"Recusandae aut velit tempore suscipit est autem. Fugiat ad animi architecto sit. Ut ullam voluptatem commodi totam nihil quas. Saepe non eveniet autem. Earum aut in sunt doloribus ut quam qui maxime."
542,"2017-05-24 03:09:54.635","lucius.gulgowski",89,4,"Hic id quae vero ab eum aspernatur. Libero qui sit qui inventore ea. A facere sit non facilis. Veniam dolores et ducimus cumque excepturi suscipit doloribus nisi."
543,"2019-07-10 10:46:03.035","armani-robel",89,4,"Velit et quisquam laborum dicta odit libero voluptatibus. Omnis deleniti magni distinctio odio. Eligendi ducimus temporibus omnis quo veniam. Quos est voluptatem similique sit quam nihil."
544,"2018-01-01 00:34:39.775","deja",90,4,"Aut aut eum vero atque velit vel. Dolorem sunt animi facilis voluptatum aut. Aliquam rem omnis possimus."
545,"2018-10-24 01:46:57.269","osvaldo",90,4,"Sed eos eveniet ducimus molestiae atque dolor quis commodi. Laudantium necessitatibus eligendi reiciendis itaque nesciunt et. Inventore officia id exercitationem consequatur. Unde alias voluptates iste perspiciatis quidem voluptatum consectetur. Sint id sint officia fuga minus."
546,"2019-05-14 02:36:23.137","rosalyn",90,4,"Quas atque qui vero fuga ut occaecati. Unde pariatur modi dignissimos eos explicabo eos. Debitis eveniet et facilis."
547,"2019-01-30 23:22:53.647","norwood",91,5,"Molestiae quidem debitis et maiores blanditiis harum amet. Necessitatibus dolorum nostrum id eos. Quasi labore sed quasi nisi et quidem voluptate quod. Enim sunt doloribus voluptatum. Nam cupiditate odio autem voluptas totam tempore rerum molestiae."
548,"2019-01-14 03:08:57.513","rossie.waters",91,5,"Eaque et natus cupiditate sunt. Accusamus temporibus est molestiae unde eum quisquam est. Voluptas voluptatum possimus nobis ut consequuntur eius minus occaecati. Id culpa iusto at."
549,"2019-01-12 22:58:24.221","webster",91,5,"Ducimus voluptatum est iure animi est minus eos. Ut sint nulla accusamus. Placeat eveniet omnis dignissimos."
550,"2019-02-23 01:56:54.466","bradley-mohr",91,5,"Excepturi omnis qui ea placeat. Sed illum voluptate aut quia. Tenetur est odio aut. Suscipit esse accusamus eveniet itaque aperiam ad modi."
551,"2020-01-28 14:48:00.426","florian-hahn",91,4,"Ea et eos cupiditate adipisci sed sed consequatur. Quod qui voluptatem dolor. Aut quos maiores et sit quas odio exercitationem molestiae. Distinctio corrupti nobis commodi."
552,"2019-10-02 03:37:19.45","kenna",91,4,"Maiores et libero iste pariatur nesciunt. Nesciunt aliquam iure odio. Et voluptate eligendi laborum dolor dolores fugit eligendi sit."
553,"2019-06-26 12:33:56.667","mac-schimmel",91,4,"Suscipit ut eos officiis et velit. Sunt adipisci placeat ut unde officiis excepturi. Veniam rerum molestiae qui nesciunt nemo. Sit fuga assumenda eaque ullam enim. Animi illo libero incidunt omnis assumenda."
554,"2019-07-15 02:21:21.246","alexander",92,4,"Temporibus voluptatem velit maxime. Voluptates fuga quis eos ullam culpa sed. Eum et et dignissimos. Accusantium totam laboriosam aut sed."
555,"2017-06-24 22:10:10.177","mohammad.schoen",92,4,"Ipsum autem voluptatum numquam quod nostrum facilis iusto. Voluptatibus rem modi minus alias. Et id voluptas enim minima. Facere excepturi commodi adipisci."
556,"2018-02-13 19:37:39.439","marjolaine.rau",92,5,"Molestiae laborum dignissimos optio dignissimos repellendus dolores. Qui aut aut et voluptatibus quis. Sed non et aliquid quia eaque magni occaecati."
557,"2018-07-05 10:27:12.522","isom",92,4,"Sed hic quia consequatur quis aperiam dignissimos dolorem. Autem quisquam veritatis voluptates et iste dolore. Nesciunt non non aperiam placeat quo voluptatem numquam aut. Est voluptas veritatis et at."
558,"2017-05-29 10:17:36.194","kayla.bins",92,3,"Repellendus culpa totam qui et expedita asperiores pariatur. Delectus itaque voluptatibus quia aut est quos aut perferendis. Inventore aut vero rerum explicabo adipisci ea alias. Voluptas sed mollitia laborum autem."
559,"2018-11-09 22:29:45.85","myles",92,5,"Nihil officia accusantium laboriosam et odio. Quidem in ut doloribus qui cumque recusandae. Non qui et est suscipit est consequatur natus. Similique alias sint itaque nam occaecati sed voluptatibus. Sit blanditiis autem non doloribus."
560,"2017-11-22 19:02:31.191","kody.green",92,5,"Laborum voluptas corporis est non rerum consequatur voluptatibus. Dolorem libero accusamus sit. Neque nihil quae amet aut occaecati laudantium quod."
561,"2019-04-11 12:31:05.243","ronaldo",95,4,"Iure vel unde consequatur earum. Officiis aperiam distinctio dolorem. Cum et beatae nesciunt sunt reprehenderit. Quidem voluptatem ut dicta nemo dolorem hic possimus velit. Sit aut eum rerum dolorum nihil voluptatem."
562,"2019-03-20 21:55:09.151","rodger.stroman",95,4,"Sunt voluptatem id natus earum dolorem voluptatem et consectetur. Saepe placeat quos sunt repudiandae voluptatem. Numquam beatae ipsam et. Quia quia perferendis deleniti aspernatur. Enim sunt ratione numquam ut minima dolor molestias laboriosam."
563,"2017-10-01 20:17:14.194","stevie",95,4,"Sunt cupiditate rerum magnam inventore aperiam sed aut adipisci. Iste dolorum voluptatem dolorum maxime non voluptates. Aspernatur perspiciatis voluptatem reprehenderit enim repellat harum culpa. Quia ut est a commodi maxime. Sint eligendi possimus sint excepturi eos porro doloremque autem."
564,"2019-01-10 13:55:09.274","evert",95,3,"Dolores harum iste dolores asperiores rerum sunt consequatur numquam. Molestias perspiciatis quibusdam dolorum voluptatem facere. Quas et facilis doloremque velit asperiores molestiae dolores id. Dolor similique ut sed sint sed commodi."
565,"2019-06-06 13:00:01.538","jarrod.leuschke",95,4,"Labore error deserunt vel et voluptas dolorem. Sequi nobis nesciunt ad. Atque tempore animi et necessitatibus excepturi."
566,"2017-12-27 18:42:50.048","judah-okeefe",95,5,"Natus atque ea porro inventore rerum. Eveniet nam fuga quos tempora voluptates quod ea. Quia sit consectetur voluptas facilis accusamus totam officiis. Aut quaerat aliquam fugiat blanditiis quaerat. Et quas iste voluptates ut et."
