"id","created_at","reviewer","product_id","rating","body"
232,"2019-09-30 15:40:53.945","mireille",44,5,"Neque dolor dolor ullam. Ut magnam sit quaerat non eum aliquam id officia. Repellat in eum officiis asperiores consequuntur quis et enim. Commodi similique molestiae ad."
233,"2017-03-21 13:11:16.02","verdie.moen",44,2,"Temporibus minus sequi consequatur quis et vel. Ipsum ut eos enim fugit molestiae consequatur nostrum. Qui atque soluta at molestias exercitationem perferendis labore. Praesentium laboriosam pariatur suscipit earum aliquam tempore. Laboriosam est sit accusamus nostrum placeat."
234,"2018-06-18 22:14:11.624","jalon.bauch",44,3,"Vel quam consequatur quo est nisi eum laudantium. Dolor corporis sequi autem. Beatae et occaecati autem sed sequi dolorem nobis."
235,"2018-07-05 18:35:53.705","neha",44,5,"Distinctio tenetur sequi excepturi sunt aut et. Ratione qui harum illum ducimus error blanditiis laborum. Iste at eos porro facere enim exercitationem qui. Nostrum qui accusamus impedit aspernatur voluptatem quasi fugiat."
236,"2019-05-06 11:57:53.249","dejah-ondricka",44,4,"Et magnam autem quae nihil quia debitis est. Suscipit quia odit voluptatem id. Numquam magnam maiores quia vel fugiat est omnis. Unde explicabo consectetur qui mollitia qui aspernatur."
237,"2019-04-02 15:45:36.848","jonathon.rutherford",45,2,"Quod accusantium qui itaque aut optio. Reprehenderit est quo beatae. Qui totam voluptatum nisi a qui est repellat. Quia voluptatibus dolor veritatis minima. Magni nostrum ex rerum omnis omnis."
238,"2019-06-01 04:27:33.743","vivienne-frami",45,4,"Repellendus sint ut qui. Praesentium officiis eligendi ut. Sit aut id velit voluptatem vero. Dolor vel aut est consequatur omnis tempore."
239,"2018-11-06 09:23:59.664","filiberto-considine",45,1,"Inventore eos aut error commodi dolor quasi id sunt. Ab consequatur eligendi et aliquam et. Laborum similique omnis ab harum."
240,"2019-02-02 19:47:40.714","abdul.spencer",45,1,"Modi quibusdam aut cumque animi consequuntur sapiente. Ratione eligendi nostrum perferendis qui quia rerum. Eos quia veniam ducimus est perferendis iste quo."
241,"2017-08-04 23:33:23.001","lincoln.corkery",45,4,"Nesciunt qui vel voluptate repellendus sunt consequuntur voluptatem ut. A quo quia omnis laudantium enim et. Aut nobis culpa iusto perspiciatis. Aperiam sit illum enim odio perspiciatis consequuntur odio sit. Maiores qui molestias doloremque et minus."
242,"2016-06-06 08:07:04.209","jewell",45,3,"Et voluptate ut magnam aspernatur. Cupiditate a eos nihil harum distinctio voluptatem qui quasi. Laborum aut nostrum rem odit."
243,"2016-12-17 02:39:08.938","evert-prohaska",45,4,"Odio ullam voluptas quas neque vel eum. Autem voluptatum magni dignissimos rerum quos labore. Voluptatem facilis odit est."
244,"2016-10-24 12:03:04.282","germaine.littel",46,4,"Facere vero doloribus aperiam inventore consectetur eum. Rerum fugit laudantium voluptates consequatur qui. Consectetur molestiae deleniti velit quasi enim ut nobis. Est veritatis autem ea distinctio laborum facilis. Voluptas et quas labore sapiente minima inventore omnis."
245,"2017-04-14 12:37:20.341","joel.hartmann",46,4,"Et ut deleniti perferendis. Iste doloribus illo quis reprehenderit assumenda quo. Est quos voluptatibus ipsam. Maiores excepturi deserunt et ut praesentium aliquam est quidem. Tempora nam nulla laborum id."
246,"2018-07-19 05:29:29.839","rylee-wisozk",46,4,"Dolorem atque aut in id explicabo nulla nesciunt. Laudantium aliquam aut iusto consequuntur voluptas et adipisci quia. Unde reiciendis voluptatem ab. Cumque qui quis iste aut architecto. Harum explicabo nihil impedit cupiditate aut dolor eveniet."
247,"2019-05-23 09:43:54.997","zetta",46,4,"Placeat rerum aut omnis excepturi quos sapiente ea. Optio velit voluptatum numquam eum distinctio ea dolores. Voluptatem at et sit pariatur voluptatem. Est libero autem architecto expedita expedita aut."
248,"2019-04-10 03:16:07.74","shakira.considine",47,4,"Non qui exercitationem iure aperiam aliquid qui aut. At velit velit exercitationem rem deserunt et sunt. Repellat perspiciatis porro sit quia."
249,"2019-05-17 18:56:18.495","lillie.kub",47,4,"Qui suscipit natus vel eum vel recusandae. Natus perspiciatis dolorem libero ipsum nostrum. Reiciendis ipsa voluptatem quasi tempora voluptate."
250,"2018-03-01 18:04:50.665","kristy.bernier",47,5,"Voluptatem voluptatem odio aut voluptatem. Velit inventore eveniet rerum adipisci et blanditiis illum. Blanditiis iure veritatis beatae enim. Sapiente quia corporis et quaerat enim."
251,"2019-09-01 04:14:41.528","rafael",47,4,"Quia magnam eum adipisci voluptatem. Eveniet animi enim id vitae sunt ex. Sit beatae qui voluptatem sit vero."
252,"2019-05-29 06:11:56.534","pat",47,5,"Sunt quia quis vel sit sit neque nihil. Natus voluptas hic sit veniam. Expedita tempore aut vel ullam impedit est. Vitae impedit ut qui dicta omnis dolorem quia."
253,"2018-02-19 18:37:30.157","ciara",47,4,"Quisquam autem quisquam neque odit odio et expedita. Accusantium ea praesentium nostrum odio qui. Aliquam aut sint sit eveniet quae voluptas suscipit blanditiis."
254,"2018-09-23 00:44:35.501","dean",47,4,"Est blanditiis et aut vitae. Neque autem voluptatum voluptas ut quis dignissimos aut nobis. Est deserunt aut quae quisquam impedit voluptates. Possimus et quos aspernatur aut sapiente."
255,"2018-11-11 10:37:45.058","obie",48,5,"Voluptatem deserunt ut sint magni necessitatibus ex non ut. Ipsum soluta sint veritatis. Modi accusamus illum aut rerum voluptatem sed quis. Eius sed quis voluptas quis et maiores laborum."
256,"2019-11-17 05:32:04.524","thurman-grady",48,4,"Aliquam sit voluptatem aliquid totam voluptates. Laudantium cupiditate molestias vitae. Beatae odio et sint. Adipisci sint laboriosam rerum eveniet voluptatibus illum."
257,"2019-10-31 04:06:03.816","shyanne",48,2,"Et voluptatem temporibus sed ut. Soluta quis magnam nemo. Dolores dolorem nisi est ad velit. Quo sequi non dolorem nam ab omnis ipsam. Enim enim pariatur recusandae accusamus."
258,"2019-07-20 20:44:07.311","isabelle-rowe",48,1,"Eligendi autem consequatur commodi. Accusamus omnis illo commodi. Repellendus ad minima dolore pariatur at."
259,"2019-10-16 07:52:12.842","tomas",48,5,"Tenetur aut provident ullam voluptatem vel. Sit delectus aut rem magnam voluptatum et quos. Quaerat ratione aspernatur quia sint."
955,"2020-02-13 18:20:01.648","ian.lindgren",161,4,"Neque assumenda velit harum modi. Quis dolore sed sed atque. Vel ut voluptas est. Eos nobis doloribus officia."
260,"2019-05-15 13:25:23.778","heidi",48,4,"Dolores est atque dolores quis qui. Quas velit provident blanditiis laudantium reprehenderit repellendus. Nesciunt doloribus quo delectus voluptas ea repellat. Dolor accusantium ipsum est."
261,"2018-04-17 18:28:27.369","carlo.labadie",48,5,"Impedit impedit aspernatur fugiat quos. Molestiae excepturi praesentium voluptatem perspiciatis ut nobis ut enim. Qui eveniet neque aliquam dolorem quod harum libero dolores. Quisquam ut eum dignissimos libero est voluptatibus. Vero magnam facere qui cum."
262,"2018-05-02 02:54:48.572","gerardo",48,5,"Sit iste sed aspernatur consequatur dolor. Culpa delectus facere ut eos vel tenetur quam. Eveniet sit reiciendis est adipisci laboriosam. Enim corporis non maiores quae non totam. Aut voluptatem asperiores mollitia qui sit explicabo aut qui."
263,"2019-09-25 22:03:57.423","allene-feest",48,4,"Nesciunt voluptatem ullam magni. Quae ea iste reprehenderit et suscipit quia ut explicabo. Omnis consequatur laborum provident sapiente sit aliquid facilis."
264,"2018-02-25 04:04:13.268","ansley",48,2,"Maxime voluptatibus doloremque cum. Velit et quo asperiores sit sunt doloremque. Natus ut eligendi laboriosam minima quas animi."
265,"2019-03-20 02:43:04.826","delmer.tremblay",48,2,"Deleniti possimus vero sint. Nesciunt natus vel repellendus officia assumenda. Rerum omnis quibusdam quidem veniam eos id. Aut quisquam alias dolorem expedita voluptatem in magnam."
266,"2020-03-17 05:38:56.175","edythe",48,1,"Totam unde eius odio. Doloribus sed dolor incidunt iste consequatur. Adipisci id laborum eum. Cumque id magni numquam."
267,"2018-02-03 03:53:29.947","adonis",49,4,"Voluptatem illum quasi eum id voluptates. Aut vel expedita distinctio corporis sed ipsa. Sed voluptatibus facere fuga quia. Deleniti qui inventore quos sed."
268,"2018-02-18 14:41:26.671","alex",49,2,"Natus sequi dolorem omnis cumque eum laudantium aut. Quo eius voluptatem nobis doloremque harum nobis quaerat. Inventore ut sapiente dolores sed reiciendis ut aut asperiores. Neque est quisquam dolores hic ratione repellat."
269,"2018-08-28 11:08:17.245","wiley.bahringer",49,5,"Distinctio est ut ipsum quo. Quisquam illo eveniet aut laborum veniam. Quo id quo ut consequatur. Vel dolores commodi incidunt sapiente maxime."
270,"2017-11-04 09:46:30.94","antone.dooley",49,4,"In praesentium cupiditate ex velit nemo. Et nostrum aspernatur suscipit. Praesentium exercitationem id at nihil."
271,"2019-09-25 11:18:56.286","ariel-rolfson",49,2,"Nam et modi recusandae recusandae soluta in accusantium. Et ea placeat tempore cumque dolorem aperiam eligendi est. Omnis mollitia delectus illum commodi."
272,"2018-12-30 14:55:45.636","dewitt",49,5,"Ullam ducimus modi quam nisi rem autem. Molestias ut unde est sunt soluta dolor quis. Non quos vel laborum velit similique voluptate."
273,"2019-06-10 08:25:33.637","hassie.dibbert",49,4,"Suscipit qui vero voluptas aut culpa. Magni aliquid fugit repellendus illum doloribus occaecati aspernatur. Sint error ut vel."
274,"2020-01-21 01:02:34.656","alize",49,4,"Possimus maxime laboriosam animi ipsa non sapiente voluptatem adipisci. Impedit modi voluptatem dolor ex deleniti sed. Doloribus omnis in eius eos."
275,"2019-09-20 19:47:31.524","jaden",49,4,"Corporis itaque impedit eligendi nemo aut adipisci et quasi. Est vero est enim placeat iure. Fuga inventore mollitia numquam sed dolorem."
276,"2017-11-29 14:00:56.186","bobby.hartmann",49,4,"Officiis optio quasi placeat aliquam excepturi illo dignissimos. Esse veritatis vitae voluptate veniam. Quia dolorem repudiandae magni enim corporis quidem eum. Sit et laboriosam excepturi. Similique sed quae consequatur."
277,"2017-10-03 10:52:53.129","thora.cruickshank",49,4,"Repellendus quibusdam aperiam occaecati dignissimos consequatur mollitia unde. Et libero vitae est vel. Molestiae cupiditate omnis deleniti sit ea nisi. Quia quos dolorum quaerat dolorem earum."
278,"2018-06-22 16:38:28.153","destini-zboncak",50,3,"Similique ratione odio illum. Placeat autem vitae nam voluptas odio voluptatem dolores et. Quis consequatur alias sit est."
279,"2019-02-28 18:30:47.797","hillard",50,4,"Et ea rerum voluptatem. Blanditiis non est omnis. Quos sunt aperiam sed et nesciunt temporibus eum. Aut autem tempore nobis et hic mollitia hic. Eaque blanditiis ab voluptas."
280,"2018-11-20 06:25:18.819","ned",50,5,"Veniam dolores nobis ullam sequi ratione ducimus. Aspernatur aut tenetur sed rem ipsum dolore in. Quod quia facilis a in vel et voluptatem nesciunt. Natus distinctio corporis quia rerum voluptatibus officia consequatur."
281,"2018-07-05 08:37:25.807","enrique.adams",50,4,"Explicabo voluptas nemo enim. Rerum odit voluptatem voluptas eum. Quos sed est fugiat rem omnis vel accusamus."
282,"2019-10-07 13:43:01.67","letitia",50,5,"Aut voluptate recusandae ducimus. Possimus et distinctio expedita cumque quas minima. Rerum deleniti iure nesciunt adipisci id pariatur harum. Harum aperiam omnis eos odit quis asperiores ea dolorem."
283,"2018-08-04 08:10:39.816","ulises-flatley",50,4,"Voluptatibus molestiae provident dicta earum dolor cumque recusandae. Aut aut est velit. Vitae soluta et molestiae nihil magni non ipsa. Est sequi repudiandae praesentium fugit quod et est dolorem. Amet suscipit quis voluptatem."
284,"2019-05-02 15:23:17.299","vicenta",50,4,"Mollitia earum quas voluptas error dolor. Molestiae quisquam qui eligendi. Modi adipisci animi excepturi sit voluptas. Nesciunt eos dolorem aliquam natus quibusdam."
285,"2018-01-13 11:53:14.08","rhea",51,5,"Sed autem quos vitae. Eaque totam voluptas consequuntur eaque ut vel a. Dolore nostrum iure voluptatem quo maiores sint quidem. Sunt pariatur occaecati exercitationem voluptatem. Consequatur sit eius culpa voluptas molestiae ducimus."
286,"2017-06-10 20:56:22.035","paul-frami",51,4,"Voluptas repellat similique occaecati maiores et repellendus maxime sint. Quaerat voluptatem veritatis eveniet quidem. Molestias et rerum molestiae. Voluptas quasi quia beatae voluptatem voluptatum enim sunt nesciunt. Cum ipsam dolore distinctio molestiae dolores qui ut."
287,"2018-01-16 16:10:33.522","alexandria.gutkowski",51,2,"Minima voluptas et totam. Porro ea repellendus nisi quod provident. Doloremque et eaque placeat nihil quia et qui et. Cupiditate excepturi iusto labore et. Sint necessitatibus tempora molestiae alias ut aperiam veritatis sequi."
288,"2016-09-17 15:23:54.628","darby-trantow",51,4,"Omnis deleniti cupiditate aperiam illo. Iste ratione at dolorum. Qui minima officia architecto eius labore. Voluptas vel aut incidunt voluptas et iste accusamus."
289,"2018-06-28 21:43:15.546","sabryna-stark",52,4,"Sit quia excepturi est dolor qui. Sint sed sequi voluptatibus eos consequuntur. Quisquam aperiam voluptatem rem quibusdam eveniet et incidunt exercitationem."
290,"2019-05-30 12:54:19.428","marshall",52,5,"Quas culpa voluptatem quis officia consequatur ullam. Iste et explicabo dignissimos qui dolor rerum. Neque facere non est natus. Doloremque reprehenderit ipsum dolores quo a."
291,"2019-11-30 03:38:11.173","miguel",52,5,"Veritatis numquam qui sapiente. Id dolores iste molestiae ducimus repudiandae eos voluptas. Similique eos voluptatem saepe nemo rerum consequatur voluptatem autem. Est quos quia rem illo fuga."
292,"2019-03-30 09:30:43.588","vivian.weissnat",52,4,"Consequatur non reiciendis quisquam. Quae quia odit aperiam impedit dolores pariatur doloremque. Architecto quis et debitis qui consequatur ex."
293,"2018-12-20 08:44:30.122","beaulah-graham",52,4,"Saepe voluptatem dolor voluptatem et rerum quaerat laboriosam consectetur. Magnam quis autem vero est architecto minus. Dolor deleniti a architecto. Cum ipsum adipisci modi eum ut. Veniam velit et cum consequatur voluptas."
294,"2018-05-23 10:22:35.169","barry",53,4,"Rem numquam fuga fugit saepe tenetur ut. Nihil molestiae quisquam accusantium tempore dolor. Dolorem recusandae eum velit architecto rem animi blanditiis. Voluptates provident ut iusto."
295,"2018-05-11 21:10:25.872","lonzo.kunze",53,4,"Neque nisi blanditiis dolor repudiandae nostrum architecto. Est ut doloremque nobis molestiae nobis. Quam tenetur porro quis."
296,"2018-11-10 21:45:09.192","antonia",53,5,"Consectetur sint ut repudiandae. Adipisci quis nemo reprehenderit sunt. Accusamus laudantium aliquam similique quia laudantium rem non cupiditate. Ea repellendus rem voluptatem sequi quasi. Quia numquam distinctio aut odio dicta temporibus molestiae doloribus."
297,"2017-06-01 10:39:14.719","jackeline-goldner",53,5,"Ipsam eos cupiditate quis est dolores autem. Consequatur excepturi sed provident. Natus voluptatibus deleniti natus."
298,"2019-04-12 11:07:23.078","gerardo-pfannerstill",53,4,"Nisi ab velit sed hic. Provident distinctio quidem inventore. Laborum sint voluptatibus accusantium explicabo mollitia fugiat sint in."
299,"2019-09-27 09:06:22.581","alexa.leannon",54,4,"Adipisci impedit dignissimos nesciunt laboriosam ut voluptatem assumenda. Ut architecto in vel officia. Et sed accusantium fugiat atque dignissimos facere. Eos soluta nostrum autem autem. Eligendi quos quasi ratione corporis aut nemo voluptas voluptatibus."
300,"2017-12-19 01:05:51.204","tristin-feest",54,3,"Aut sed est labore laudantium odit minima. Commodi placeat ratione ab totam provident. Corrupti a et cum delectus ad. Facilis dignissimos id omnis ut ut."
301,"2018-06-15 20:40:00.344","larry",54,3,"Hic et deleniti maiores vero molestiae et et rerum. Maiores iusto quod architecto. Molestiae corporis illum enim dolor iusto esse. Dolores est sapiente et dolorem aut atque accusamus aliquid."
302,"2019-07-03 15:24:44.683","violette",54,4,"Eaque aspernatur non architecto qui repudiandae veniam laboriosam. Ex est distinctio aut. Ut sunt aut aliquam ut consequatur voluptatem quaerat. Mollitia perferendis quaerat exercitationem."
303,"2018-01-08 13:52:53.191","dion-gutmann",54,5,"Labore labore molestias quia. Dignissimos aliquid excepturi totam facere et. Dolore officia sed dolorem et aliquam. Sit modi quaerat eius nemo nostrum illo blanditiis."
304,"2017-05-20 23:04:33.603","shyann",54,5,"Eius cupiditate voluptas eligendi sapiente laborum id. Temporibus esse iste repellat. Vitae esse pariatur veritatis rerum mollitia cupiditate. Possimus ea totam possimus doloremque et accusamus et."
305,"2020-02-06 12:01:50.611","kylee",54,1,"Quia voluptatem est quia dolore iste quod. Consequatur deserunt rerum debitis ullam enim tempora. Dolor quia minima ipsa occaecati nihil molestiae. Et iure sit nostrum voluptatem veritatis."
306,"2017-03-16 07:24:13.903","caesar.rempel",54,3,"Dolor non possimus est. Voluptas commodi laboriosam quia ut nihil autem nostrum. Totam molestiae quaerat doloremque harum aut perferendis consequatur placeat. Assumenda tempora reprehenderit autem praesentium tempore doloribus corrupti dolorem. Aperiam enim perferendis est quibusdam illum minus."
307,"2016-12-09 23:40:29.401","vicky",54,5,"Doloribus eum rem enim repellendus quas quis rerum. Quod pariatur minima aut voluptatem sint facilis. Itaque aut nihil dolore."
308,"2020-01-06 12:41:13.938","greta",56,2,"Maxime quibusdam impedit nostrum quo. Excepturi excepturi non sed rerum dolor quo quia. Earum rerum ut animi veritatis voluptas. Dolores omnis alias dolores."
309,"2019-08-27 22:39:50.609","terrence",56,4,"Rerum voluptatem laboriosam qui aut. Rerum ut qui soluta aperiam fuga quam vel earum. Optio alias rerum velit omnis molestiae. Eligendi quibusdam et similique."
310,"2019-03-07 23:19:48.043","eugenia.bernhard",56,5,"Non est at doloremque in minima magnam amet quibusdam. Quibusdam rerum molestiae exercitationem. Voluptatem unde qui vel voluptatum."
311,"2018-05-14 09:45:53.874","laverne",56,5,"Ipsam quaerat expedita eligendi incidunt rerum. Voluptatem autem nihil autem tempore sunt. In explicabo optio alias quia quos maxime nihil minus."
312,"2020-01-09 11:19:44.087","miller",56,4,"Incidunt iusto et consequuntur facilis. Expedita aut ut minus. Repellat et qui incidunt hic assumenda rerum illo est."
313,"2020-02-16 22:38:47.37","vincent",56,4,"Consequuntur provident quisquam voluptas nam. Esse aut laborum aut totam sit corrupti cupiditate. Iusto fugit ea temporibus et incidunt delectus error. Doloremque laudantium et quia qui."
314,"2017-11-29 06:26:48.819","willa-tremblay",56,5,"Adipisci odio nisi harum velit numquam numquam necessitatibus cum. Ipsam voluptatem quia nesciunt deserunt aut ea consequatur. Quisquam nesciunt veniam aspernatur at et esse."
315,"2020-01-11 16:21:15.54","kevin.douglas",57,4,"Occaecati veritatis iusto sunt praesentium nobis. Nesciunt non quia aperiam et. Qui nobis officiis perspiciatis magnam animi beatae."
316,"2019-05-21 10:28:43.272","jaron-grimes",57,4,"Ratione eius illum ut error. Sunt in nihil dolores. Minima voluptatum ut laudantium nostrum. Accusamus aliquam alias maiores esse exercitationem amet accusantium."
317,"2019-03-05 07:36:33.956","talia.kreiger",57,3,"Est alias qui quas pariatur. Inventore nulla rerum repudiandae voluptatem modi. Dolores consequatur ea rem nostrum distinctio rem. Id nemo saepe voluptatum suscipit occaecati voluptatum sed incidunt. Laboriosam id qui voluptatem mollitia ut voluptatem rerum nulla."
318,"2018-06-22 01:23:44.232","aisha",57,5,"Consequatur omnis unde velit. Odio distinctio officia expedita corrupti. Reiciendis aspernatur molestias ut quod eos mollitia sequi. Esse quaerat nam animi. Voluptas sit omnis doloremque magnam magni."
319,"2019-07-24 10:01:43.588","nestor-wehner",57,1,"Illum voluptate sed reprehenderit ut accusantium. Tempore vel at eaque et. Modi commodi inventore voluptatem. Rerum voluptatum quis aut."
320,"2020-02-16 14:36:41.366","rosalinda",57,4,"Corporis nam ea accusamus consectetur aut qui. Voluptas iure adipisci esse ea et non laboriosam est. Repellendus quia aut asperiores tempore aut."
321,"2018-08-07 03:48:31.952","murl",57,4,"Assumenda perspiciatis odio ut officia tempora. Quos illo fuga culpa quam impedit doloremque placeat suscipit. Ab rerum veritatis ipsum quaerat occaecati ut."
322,"2019-08-12 15:52:13.022","vickie",57,4,"Quia magnam velit velit quidem non sed adipisci voluptatem. Nam perspiciatis quaerat voluptates. Molestiae in neque voluptatem."
323,"2020-01-19 08:16:27.572","adalberto-hilpert",57,4,"Quia expedita exercitationem illum sequi repellat. Beatae ut quia provident quod et rerum eos. Et laboriosam vel et. Aut sequi ea et et blanditiis."
324,"2019-10-19 17:48:32.648","alva-boyer",57,4,"Est quam saepe minus repudiandae et. Aut sed placeat molestiae alias expedita. Ea quia magni modi."
326,"2020-03-29 10:43:17.493","marguerite",57,4,"Provident exercitationem at velit repellat qui et. Deserunt ut inventore est. Facere voluptas est quod iste. Assumenda fugit optio molestiae optio molestiae quod quia."
327,"2018-05-27 19:31:44.295","elliott.thiel",58,5,"Necessitatibus qui nam occaecati voluptatem voluptatum neque voluptatem. Culpa rerum officiis qui libero dicta voluptatem velit. Non qui occaecati ipsam facilis. Ut praesentium sed rerum magni commodi magnam magni."
328,"2019-02-17 20:15:27.559","mack",58,5,"Mollitia incidunt consequatur quisquam. Et nisi consequatur consequatur ex molestias id sed. Laboriosam ipsam sequi dolor."
329,"2018-10-19 14:30:38.835","felton-rodriguez",58,4,"Modi at ipsa voluptas in. Inventore aut dolore eos. Sapiente voluptatem quia et vero odio. Fugit perspiciatis et soluta eos vel natus iste."
330,"2018-01-14 03:26:18.966","candelario",58,5,"At cupiditate tempore minima. In ea est corrupti iure quia. Qui illo omnis nulla quibusdam explicabo. Qui recusandae est nihil cum et."
331,"2018-01-05 01:43:13.996","jacques-lemke",58,4,"Hic aliquid asperiores adipisci id cum. Ea pariatur nemo est quisquam impedit ipsam ut repudiandae. Qui eos ut et cumque est saepe cum veniam. Aliquam quae dolorem voluptas maxime. Quia eaque dolores et."
332,"2018-10-27 20:44:33.4","ima-marvin",58,4,"Et vel aut dolores. Omnis consequuntur maxime officia quod eligendi fugiat cumque quia. Voluptas quis enim laboriosam eum aut beatae nobis."
333,"2020-02-18 19:17:08.268","rafael",58,4,"Vitae est non et necessitatibus molestiae dicta atque. Deleniti est est hic veniam. Dolor saepe omnis optio quod ut. Asperiores aut atque ipsa ad aspernatur atque."
334,"2018-05-24 23:38:29.652","constantin",58,4,"Qui commodi similique laudantium consequatur dolor natus nemo. Officia accusamus est eos. Vero laboriosam odit autem suscipit. Voluptatem optio iusto nobis ut."
335,"2019-05-01 13:41:24.994","odessa-purdy",59,4,"Aut sequi iusto nesciunt dolor. Quam dolor repellat molestias ipsam. Quia dolor sed dolor et perferendis aspernatur dolores provident. Et eos ut debitis dolor ea ipsum. Accusamus consectetur et atque assumenda ducimus non fugiat eum."
336,"2020-01-31 03:15:39.408","bradford-dibbert",59,1,"Autem quibusdam illo non velit. Quis nemo aut nemo qui recusandae porro laboriosam. Ipsum ut aperiam voluptatem non a quidem voluptatem. Reprehenderit quisquam quo porro optio eveniet alias vel voluptatem. Exercitationem a debitis aut ut ipsa eveniet consequatur."
337,"2018-09-18 21:47:29.066","abdiel.murphy",59,4,"Rem sint ut minima nam. Provident corporis sapiente asperiores maxime. Quae earum earum porro amet quos hic fuga. Occaecati est quisquam dignissimos dolores explicabo voluptatem. Suscipit harum eveniet optio aut aut."
338,"2019-07-14 19:58:37.673","alta",59,4,"Iure magnam provident neque. Maiores qui delectus velit quae. Itaque consequatur incidunt ratione omnis eos. Iusto enim accusamus explicabo quam. Labore magnam rerum cumque eius quas vel nihil."
339,"2019-07-11 01:01:06.576","alf-jast",59,5,"Nihil eligendi et inventore eius beatae officia. Veritatis autem at perferendis explicabo qui aut sit esse. Dolorem quae est voluptas voluptas. Qui ad officia ut voluptates et reprehenderit officia quo."
340,"2018-11-19 08:00:51.265","myrna.ernser",60,5,"Molestias sit et quod culpa. Sed modi temporibus voluptatem omnis distinctio rerum dolore aliquid. Voluptatem et non ducimus ut non. Ullam accusantium eos et eius quae nam sunt itaque. Sint temporibus enim et tenetur."
341,"2019-01-21 22:48:56.567","gus.nolan",60,5,"Veniam ipsa enim beatae beatae voluptas ducimus minus. Vitae voluptate iure autem voluptas eum sed nihil. Facilis atque ipsum ut perspiciatis voluptatem. Non sint voluptas magnam."
342,"2018-11-24 13:12:29.742","sheila",60,5,"Aliquid dolores ducimus aut error explicabo ullam. Officia hic dolores dignissimos ut quibusdam impedit suscipit. Et sed at blanditiis. Ab iure repudiandae totam sed atque omnis. Necessitatibus dolorum est libero rerum nobis quibusdam eum."
343,"2018-11-28 10:43:17.027","webster.anderson",60,4,"Facere esse reiciendis illum iusto porro cumque qui. Ipsam debitis et excepturi ut. Dolorem id commodi alias sed a sapiente."
344,"2018-01-12 11:30:28.948","watson-leannon",60,5,"Optio hic ut omnis voluptatem doloribus ut fugit aut. Necessitatibus quia consequatur corporis libero nobis. Quibusdam voluptatem et quia est architecto quasi. Cum deserunt voluptatibus aperiam a nam tenetur exercitationem."
345,"2018-02-16 02:56:08.759","verlie",60,1,"Perspiciatis sed a eius aut saepe repellendus deleniti error. Quia ducimus placeat eum deserunt nobis in. Dolor molestiae sunt itaque voluptate fugiat dicta ea. Et distinctio incidunt rem inventore dicta ducimus velit est."
