"id","created_at","reviewer","product_id","rating","body"
1,"2018-05-15 20:25:48.517","christ",1,5,"Ad perspiciatis quis et consectetur. Laboriosam fuga voluptas ut et modi ipsum. Odio et eum numquam eos nisi. Assumenda aut magnam libero maiores nobis vel beatae officia."
2,"2019-08-07 13:50:33.401","xavier",1,4,"Reprehenderit non error architecto consequatur tempore temporibus. Voluptate ut accusantium quae est. Aut sit quidem nihil maxime dolores molestias. Enim vel optio est fugiat vitae cumque ut. Maiores laborum rerum quidem voluptate rerum."
3,"2018-03-30 00:28:45.192","cameron.nitzsche",1,5,"In aut numquam labore fuga. Et tempora sit et mollitia aut ullam et repellat. Aliquam sint tenetur culpa eius tenetur. Molestias ipsa est ut quisquam hic necessitatibus. Molestias maiores vero nesciunt."
4,"2017-11-13 22:29:12.121","barbara-shields",1,4,"Est accusamus provident non animi labore minus aut mollitia. Officiis voluptatem quo dolorem sunt qui ipsum nobis totam. Et qui et qui quia ipsa ipsam minima."
5,"2017-11-19 07:08:54.771","clement",1,5,"Id sed sint corrupti molestias ad alias aut in. Nihil debitis ipsum repellendus voluptatem facere. Fugiat fugiat necessitatibus nobis hic."
6,"2018-02-11 03:05:17.346","jaunita",1,5,"Omnis pariatur autem adipisci eligendi. Eos aut accusantium dolorem et. Numquam vero debitis id provident odit doloremque enim."
7,"2020-01-31 12:35:59.147","perry.ruecker",1,5,"Non unde voluptate nam quo. Quibusdam vero doloremque ut voluptas. Sequi commodi voluptatem vero debitis velit in. Quis dolores id qui aut voluptatibus. Magnam laborum sunt sit saepe reprehenderit."
8,"2019-12-10 16:16:36.999","cristina.balistreri",1,4,"Quia ullam qui quae distinctio non nostrum laboriosam. Voluptatum velit et est dolore corporis sed. Dolore quia non illum quia omnis laudantium tempore."
9,"2019-11-06 10:43:14.868","wilma-muller",3,4,"Quo sed optio cum. Et officiis cumque quis. Facere unde porro sit voluptatem nulla incidunt. Rerum accusantium aut consequatur quae. Rerum ut eligendi vel repudiandae voluptates."
10,"2019-02-13 17:37:35.244","herman-marquardt",3,4,"Est consectetur impedit sit. Distinctio corrupti ut magni provident recusandae aliquam qui error. Omnis et debitis pariatur doloribus quia blanditiis eaque. Voluptates ut eum minus quasi alias. Officiis nostrum facilis possimus."
11,"2018-10-22 23:12:30.534","carolyne",3,4,"Blanditiis sequi reprehenderit nesciunt eos numquam a alias quibusdam. Et alias dolor vel. Non enim corporis magni dolorem voluptatem laudantium sit."
12,"2018-11-26 23:42:48.594","ralph-klocko",3,4,"Sint sed et libero excepturi aut. Nihil tempora reprehenderit et et harum consectetur alias voluptatum. Sed et consequatur quibusdam natus nihil non illum."
13,"2019-06-21 07:29:55.724","gerry",3,4,"Enim consequatur voluptas temporibus iusto optio. Nihil et ea iste autem est. Accusamus sint corporis ullam."
14,"2019-03-26 21:16:27.557","lula-pouros",3,4,"Placeat non inventore odit. Illum ullam rerum cum corrupti maiores. Nihil sequi molestias dolore explicabo doloremque nobis omnis. Saepe id voluptatem ut nemo. Commodi laborum qui amet hic rerum omnis iste."
15,"2019-11-30 07:00:39.059","jalon.pagac",3,4,"Minus minima ea fugit vero consectetur. Voluptatibus dignissimos quibusdam alias quam eos deserunt maxime. Dolorem exercitationem ex nobis et esse odit accusamus voluptatum."
16,"2019-04-20 04:57:57.91","kale",4,3,"Sint dicta facere cumque omnis autem. Non tempora voluptatem iure. Modi quia modi voluptatem. Autem ratione tempora qui."
17,"2018-07-28 13:49:57.756","kurt.labadie",4,1,"Necessitatibus voluptatem officia iusto. Repudiandae distinctio accusantium quae officiis nisi. Eveniet voluptatem non molestias tempora maxime voluptas quas reiciendis. Explicabo ea non enim temporibus. Alias aspernatur quos et quia blanditiis repudiandae."
18,"2018-07-31 13:05:41.95","creola-price",4,5,"Facere iusto aut autem vel qui. Velit nemo esse ipsum exercitationem est quam odit doloremque. Voluptate est molestias maxime porro. Ut exercitationem in est. Voluptates incidunt voluptatem officia."
19,"2018-09-28 22:29:23.619","kaley-nader",4,2,"Ad sit magnam voluptatem esse voluptatem. Natus ut quo labore soluta ex exercitationem. Sunt aperiam qui at."
20,"2019-10-09 01:52:47.56","brock",4,4,"Sit blanditiis in possimus. Ab voluptatem aliquid amet libero eos rem nemo. Sed officiis maiores id cum facere cupiditate veniam. Et magnam qui ea aliquid."
21,"2019-09-18 23:37:03.454","meghan",5,4,"Eos consectetur adipisci perferendis neque laborum. Veritatis repellat eum distinctio vitae eum asperiores fuga illo. Tempora iusto aut rerum aut reprehenderit. Eos aut veritatis assumenda omnis."
22,"2019-08-20 19:36:44.051","pedro",5,5,"Et libero velit recusandae voluptas adipisci voluptatem nulla. Odit minima totam vel. Est dolore porro ratione tempore."
23,"2017-09-26 22:31:06.534","theresa",5,5,"Voluptatem nulla quia ea dicta. Voluptatem vel commodi in. Quisquam architecto quas ea perferendis."
24,"2017-12-09 10:48:26.839","yoshiko",5,2,"Non sint sit aut unde. Ullam ut delectus ipsam consequatur. Dolor sed dolor est dolorem dolores ipsa voluptatem dolor. Unde delectus optio inventore ab corporis voluptatibus."
25,"2018-08-13 02:20:13.488","davin.rowe",6,5,"Fugiat corrupti perspiciatis laborum nulla debitis a soluta. Possimus ab quis laudantium amet nulla. Maiores aliquid voluptas magnam quia sunt autem."
26,"2018-02-10 15:22:39.741","beatrice-ward",6,4,"Odit tempore maxime vel omnis id consequatur. Ratione non repellendus eaque. Optio sit expedita est et quia alias debitis. Incidunt ab alias est repellendus vel dolores qui."
27,"2020-01-07 06:01:18.999","grace",6,4,"Minima non hic doloribus ipsa dolore ratione in numquam. Minima eos vel harum velit. Consequatur consequuntur culpa sed eum quidem. Debitis nostrum voluptatibus et voluptatem."
28,"2018-04-29 05:54:53.293","pete",6,3,"Et non est minima praesentium est. Nesciunt ipsa omnis est voluptatem provident dolores consequatur qui. Quos est architecto exercitationem soluta delectus adipisci minima."
29,"2018-10-05 18:18:12.074","daryl",6,3,"Reprehenderit est neque sapiente at dolore aut facilis. Ea reprehenderit ut dicta et quia harum repellendus. Provident facilis nostrum quidem. Velit quod nobis dolore aspernatur suscipit."
30,"2019-11-22 04:12:40.052","mae.strosin",7,3,"Inventore qui dolorum dicta nam dolor consequatur non. Ea libero dolorum est fugiat voluptatem voluptatum qui. Quod minus maxime sequi."
31,"2019-05-20 23:21:59.929","abigale.harvey",7,5,"Reiciendis recusandae qui aperiam nam aperiam corporis et voluptatum. Dolor sapiente eum officiis doloribus cupiditate illum ullam soluta. Est totam provident et facere et odit quaerat."
32,"2018-05-14 10:41:19.568","kylie.murphy",7,5,"Aliquam sequi doloremque animi quod quia. Quos eum eum id perferendis quos praesentium et vel. Qui voluptas et dignissimos nisi."
33,"2018-04-18 21:32:02.295","terrell.brown",7,5,"Quo animi voluptatem alias iste dolores iure asperiores accusantium. Nihil libero eum qui iure eligendi quo quis omnis. Necessitatibus et molestias ducimus aut. Maiores dolorem et est."
34,"2019-04-15 22:18:56.792","devan.buckridge",7,3,"Voluptas illum officiis facere. Quas iure ut praesentium et. Sed soluta explicabo esse doloribus sed."
35,"2017-06-04 18:52:10.978","alexandrea.bartell",7,5,"Dolorem eos tenetur soluta cumque fugit quibusdam quia dicta. Omnis debitis cupiditate ipsa in veritatis sed dolore. Cumque sit eos commodi iure. Et recusandae optio quas blanditiis quasi enim impedit error."
36,"2018-02-10 18:40:43.685","michel.goodwin",7,4,"Et modi architecto cupiditate dolorem sapiente delectus et. Exercitationem consequatur non nihil delectus doloribus animi aliquid. Illum accusamus sed necessitatibus maxime eos. Et velit qui expedita laborum minima."
37,"2019-09-13 00:30:24.224","emerald-carroll",7,5,"Facilis laboriosam et expedita. Quasi accusamus architecto voluptas repellat quam expedita quidem odit. Voluptates nemo nam consequuntur doloribus corrupti nisi. Voluptatem quo excepturi veniam culpa est et."
38,"2018-09-28 02:16:05.922","skylar",8,2,"Id sed aut quo est. Vero et nobis numquam quis. Asperiores laudantium in reprehenderit quisquam. Architecto accusantium eaque adipisci. Sequi error doloremque quaerat laboriosam incidunt."
39,"2018-05-08 06:42:14.983","johnny",8,4,"Odit error sunt ipsam nihil. Esse vero voluptatibus maiores velit omnis aut nobis. Debitis quis vitae eum enim ad. Voluptate in quas quae eveniet."
40,"2019-02-01 08:43:39.868","julio",8,4,"Explicabo aut ex numquam. Voluptas est voluptate quod dolor quod. Deserunt est eos quo qui consequatur exercitationem. Eaque quod vel ut. Non libero commodi saepe molestias magni."
41,"2019-12-01 02:56:24.429","noble",8,5,"Id tenetur eaque incidunt perspiciatis suscipit dolor. Qui quia alias doloribus eum omnis quis sunt. Accusantium quos eos tempora. Sit quibusdam alias sed voluptas voluptatem. Ut rem similique magnam et."
42,"2019-07-15 04:28:05.737","juliana",8,4,"Repudiandae quae natus maxime suscipit deleniti rerum ut incidunt. Ipsam explicabo quia quo recusandae dolorum ad est officiis. Eligendi nobis consequatur voluptas molestiae saepe."
43,"2019-06-09 20:03:22.823","alvis",8,5,"Eum omnis facilis soluta qui nihil ullam minima modi. Culpa quos explicabo perferendis. Qui et et rerum animi. Et aut quos excepturi quod ipsum consectetur."
44,"2018-11-18 02:46:20.771","ethel",8,5,"Placeat est sint perspiciatis non eveniet sapiente porro voluptate. Quo est non voluptatem. Recusandae repellendus itaque id veniam. Et quam aut vitae praesentium voluptas vel sunt dolorum."
45,"2019-05-07 18:34:59.926","maia",9,3,"Reiciendis omnis corporis recusandae dicta nostrum aspernatur quas maxime. Consequuntur recusandae consectetur officia. Et et qui et odit et aut qui. Doloremque excepturi fugiat rerum rerum consequatur totam laudantium."
46,"2019-04-23 00:40:26.426","trent",9,5,"Corporis perferendis aut accusantium temporibus omnis doloribus aut exercitationem. Qui sed dicta possimus omnis. Voluptas inventore ut soluta."
47,"2019-02-09 09:00:23.913","roslyn.goldner",9,5,"Quia eligendi amet qui omnis odit ut at. Nobis facere adipisci deserunt recusandae. Adipisci sint aspernatur enim et id. Repellat repellendus qui qui. Fuga accusantium dolorum fugiat numquam molestias qui."
48,"2019-12-29 02:05:23.696","reyna.davis",9,4,"Aperiam vero temporibus corporis corporis maiores voluptatem expedita. Voluptas ipsum cumque consequatur. Impedit ut sapiente quis voluptatem aut."
49,"2018-10-26 00:15:56.189","donnie.spinka",10,5,"Incidunt totam non id laboriosam facere. Molestiae consequatur labore dignissimos voluptatem. Molestias quis autem adipisci."
50,"2018-03-18 17:28:46.007","jettie",10,5,"Omnis sed illum est maiores beatae ut corporis. Nihil iste quidem vel. Quas rerum ipsa fugiat fuga natus aliquam. Eligendi repudiandae accusantium at ea. Non numquam ut non est tenetur."
51,"2020-01-06 12:53:43.611","luther",10,4,"Et velit voluptatem blanditiis. Sunt quidem iure aut et aspernatur. Id in totam voluptas asperiores non."
52,"2017-11-12 09:30:57.613","hazle",10,4,"Et est voluptatibus qui corrupti. Nostrum fugit mollitia debitis eos voluptatem quis. Quis velit facilis provident corrupti veniam soluta officia aut. Provident occaecati minus vel ea et. Et quia atque eligendi voluptate."
53,"2019-10-18 07:00:46.983","lois-romaguera",10,5,"Eius voluptatem neque debitis ipsa earum et id quibusdam. Qui assumenda qui iure velit rerum ad voluptas sit. Odio at ex aperiam facere sed aut."
54,"2019-07-18 14:53:25.766","maeve",10,5,"Incidunt enim totam molestiae. Molestiae velit rerum sint est sed beatae. Officia totam tempora qui nesciunt adipisci qui."
55,"2017-02-21 13:15:00.956","elizabeth",10,4,"Dolor amet itaque odio at est nesciunt voluptas. Nostrum nisi nam aut est deleniti perspiciatis aut blanditiis. Nesciunt sit alias corrupti incidunt qui aut totam. Soluta corrupti qui in nulla et corrupti est."
56,"2017-12-15 04:57:05.876","lois.jakubowski",10,2,"Fugiat dolores maiores tempora quis. Voluptate quod alias quidem saepe provident perspiciatis corrupti. Qui ut et quo non id laborum quia. Eligendi aut voluptatum omnis numquam corrupti ut."
57,"2018-11-22 01:05:33.863","rhea",10,5,"Adipisci provident voluptate cum qui voluptatem. Ut quae velit velit rerum eveniet voluptas. Harum cum similique provident. Voluptatem quidem labore minima alias dolore. Molestiae voluptatem commodi ut et."
58,"2020-04-08 09:48:23.269","loren",12,5,"Ut accusantium odit sit et nihil. Voluptatum eum voluptatibus sit et dolore sed sequi natus. Ducimus cupiditate perferendis repellat expedita quos."
59,"2018-05-02 07:46:44.29","fidel",12,5,"Sed excepturi tempora saepe recusandae rerum in ex perferendis. Quia error quibusdam et omnis dolores totam. Quaerat qui ullam at omnis iusto. Voluptatem veniam optio maiores repellendus. Sunt minus ut eveniet voluptatem."
60,"2018-04-26 00:55:59.488","meta",12,5,"Aperiam autem magni sunt. Tempora voluptates vitae facere. Asperiores repellendus totam ad ullam."
61,"2020-01-01 16:50:17.06","dayton",12,5,"Dolorem eum dicta eum et. Laborum qui est et. Aut labore quia earum."
62,"2020-01-22 00:59:08.252","meghan",12,4,"Voluptate dolores est repellat. In tempora magni magni dicta autem amet. Et saepe autem provident facilis nostrum reprehenderit vero."
63,"2018-10-26 20:30:34.427","summer",12,5,"Dicta animi pariatur totam qui necessitatibus illo omnis. Quaerat ut et nostrum rerum. Minus explicabo occaecati sed occaecati aliquid molestias dolorum. Saepe debitis velit maxime consequatur fuga."
64,"2019-04-01 06:35:01.914","ollie-hudson",12,2,"Aut vel earum non. Nihil harum ullam accusantium voluptate. Voluptas doloremque inventore tempore quasi. Est magni dolor ratione placeat officia in sed sit."
65,"2020-03-29 01:22:49.789","michale-howe",14,4,"Eum nesciunt aut amet nobis. Vel rerum eligendi quae est sequi. Eaque quo ea inventore quas quo aliquam iusto est."
66,"2019-11-01 13:30:33.826","tatum.williamson",14,4,"Veritatis dolores error nisi libero cum a ut sunt. Et possimus in dignissimos. Dolorum saepe doloribus soluta sunt a. Optio consequatur quo ratione fugiat ipsum voluptatem neque. Modi corporis rerum et deleniti."
67,"2019-01-26 04:20:49.869","lowell",14,4,"Ut impedit ipsum eos. Fugiat voluptate dolor sed qui quasi aliquid sint sed. Deserunt accusamus reprehenderit aut. Esse tempora sint impedit amet eos et quaerat corrupti. Modi iure ut iure et eius temporibus dicta ut."
68,"2019-04-30 17:32:10.886","jalen",15,5,"Sed aut id facere. Nihil at doloribus eaque. Est molestiae ut non sapiente distinctio facere et totam. Aut dolorem ducimus eum quasi molestiae molestiae."
69,"2017-02-12 15:12:41.758","stewart-west",15,4,"Consectetur porro sed officia consequatur esse qui quas. In velit nemo facere sint nobis delectus qui optio. Harum iure nemo illum."
70,"2019-07-01 14:38:02.218","ryder.schmeler",15,3,"Nobis eaque officia veritatis. Accusantium quae voluptas et harum neque facere sunt. Non iusto repudiandae ut dolorum est. Omnis delectus laboriosam soluta odio. Assumenda quod ducimus id accusantium in assumenda ut."
71,"2019-01-09 16:46:13.739","noble.bins",15,5,"Sunt id ea occaecati ipsam itaque qui. Consectetur eveniet et rerum quos. Est suscipit temporibus ut alias aut. Possimus blanditiis nam voluptas. Pariatur debitis officiis qui."
72,"2017-01-26 12:42:53.019","alan",15,3,"Amet deserunt iusto ut optio natus quia eos qui. Optio sed ea doloribus. Mollitia vel voluptas eum commodi."
73,"2018-10-01 17:14:12.497","shawn",15,4,"Enim ea possimus cum. Tempora harum blanditiis facilis modi quos. Voluptas officia est itaque."
74,"2018-02-13 04:11:25.169","sylvia",16,4,"Nulla quibusdam ad voluptatem consequatur voluptatem blanditiis dolorem. Omnis et assumenda eum quisquam natus. Eligendi ut numquam veniam eaque tempore incidunt rerum consequatur."
75,"2019-12-03 10:22:06.543","dalton",16,4,"Hic quae officiis quas nostrum quo delectus corporis et. Sed a omnis quae blanditiis magnam et et. Asperiores neque nulla totam ea aut in possimus."
76,"2017-07-31 22:46:52.399","laverne",16,5,"Hic architecto nobis adipisci inventore numquam. Nam reiciendis ut eligendi consectetur a iusto beatae. Ipsam eius ea repudiandae aut."
77,"2017-10-29 21:09:52.952","kamron.hickle",16,2,"Omnis ipsam culpa voluptas repudiandae. Magnam quae veniam quia et. Laborum officia eum repudiandae id commodi."
78,"2017-04-21 10:28:11.664","ernestina",16,4,"Magnam tenetur voluptas nihil. Dolor similique voluptas quos hic amet in ut. Nihil aperiam non omnis tempora. Aut dolores quod voluptate quis quis itaque incidunt esse."
79,"2018-05-10 09:41:43.463","darren",16,4,"Et enim libero accusamus et aliquid odit ratione. Sit ea error nulla aliquid facere. Est minus quibusdam iusto. Id ipsa vitae dolor minima autem quisquam odio quibusdam. Adipisci occaecati ea delectus quia."
80,"2018-09-24 17:13:21.925","fritz-strosin",16,5,"Et voluptas repellat sed amet non recusandae voluptatem. Voluptatem minima corrupti sunt explicabo ut porro est. Ut dolor reiciendis eaque voluptate qui suscipit. Ipsum culpa vel molestias. Ipsa enim animi saepe autem quibusdam suscipit recusandae sequi."
81,"2020-04-05 13:29:00.434","joshuah",17,4,"Consequatur labore fuga aut eum sint qui earum aut. Consequatur exercitationem accusamus sunt dolor aut non ut. Ut pariatur vitae iste est quod dicta. Similique ab voluptatibus sunt dolor aliquam et voluptates."
82,"2018-07-30 10:22:43.084","cristina.bruen",17,4,"Quia aliquid eveniet tenetur est. Et odio similique autem ipsam nihil ratione. Autem quae sit nostrum."
83,"2019-10-21 10:03:50.501","vada.mcdermott",17,5,"Velit alias voluptatibus soluta suscipit ipsam et non. In ducimus quia ut veniam libero et. Nostrum sequi fugiat provident."
84,"2019-07-29 16:57:45.908","sadye",17,4,"Nihil expedita ut fuga id nesciunt rerum quam dicta. Iure quibusdam dolor labore dolorum debitis explicabo sit. Optio et deserunt quasi aut. Velit eos ut quasi quis quam."
85,"2020-01-21 18:52:03.42","emory-franecki",17,4,"A repellat impedit explicabo ullam. Et ad quis temporibus. Voluptas tenetur aspernatur saepe sequi animi veritatis et culpa."
86,"2020-03-30 07:27:53.68","tiana-pfeffer",17,4,"Aperiam placeat aut ab veniam id. Quisquam atque dolores voluptatibus illum. Numquam aliquid ea cumque quia minus corporis voluptatem et. Vitae delectus quidem ea iste sint. Qui aliquam ut est ipsa."
87,"2018-05-01 16:04:00.03","destany.cremin",17,5,"Alias saepe enim qui tempore modi. Quaerat rem mollitia quia. Aut tempora aut laborum. Et et debitis nihil atque eveniet. Et dolore perspiciatis deserunt beatae occaecati aut ex fuga."
88,"2019-07-28 22:16:44.098","jovany",17,5,"Odit est et et ex velit doloremque non. Commodi officiis ea maxime et enim qui eum voluptatem. Nisi autem blanditiis illo et pariatur quas."
89,"2019-02-28 22:00:41.936","kurt.watsica",17,4,"Nihil natus doloribus sit officia quidem nostrum quos minus. Quis animi officia est qui. Sunt ipsum ea modi. Quibusdam accusamus maxime reiciendis et eveniet illum eos beatae. Culpa similique ab quisquam."
90,"2017-08-09 06:39:07.732","ethel",17,4,"Voluptas repudiandae qui ut aut. Esse cumque deleniti alias quaerat est et. Quia optio unde unde pariatur et hic."
91,"2017-04-19 16:27:24.305","jimmy",17,4,"Dolor totam et tempora quam dolorem nemo. Voluptatem dolore exercitationem rerum accusamus quod cum. Aliquam delectus pariatur ut et consequatur id."
92,"2019-02-03 22:07:12.049","macie",17,4,"Aut pariatur totam non delectus. Vitae dolor libero velit fugit quae dolore officiis distinctio. Sit quia ut autem eveniet aperiam. Qui ratione aliquam quis ex sapiente ab assumenda."
93,"2017-10-14 20:29:26.065","mckenzie-stehr",17,5,"Ut qui aut nemo inventore id optio vero. Omnis iusto dolores sequi ipsum reiciendis qui ipsam dolor. Ut optio quisquam non omnis harum placeat ad."
94,"2019-12-30 08:09:08.127","geoffrey.von",18,5,"Dolor excepturi aut ut. Officia quas laboriosam tempore. Ut praesentium laborum aut consectetur esse quae suscipit."
95,"2019-05-18 19:45:39.728","angela-schultz",18,4,"Molestiae quisquam qui quos est aut. Occaecati nostrum est eligendi nam quia vero eius reprehenderit. Repellendus eligendi architecto ea."
96,"2018-12-05 21:47:07.095","adam",18,5,"Ut molestias et architecto optio. Eius cum ut deserunt. Et magnam quasi autem ex occaecati ullam alias magni."
97,"2017-05-02 23:14:47.478","desmond-barton",18,4,"Corporis enim ea in ut. Iusto magni sequi doloribus consequatur qui. Qui in ullam debitis atque necessitatibus. Quia aut modi deserunt ratione."
98,"2019-07-08 11:53:28.944","brennan.watsica",18,4,"Et est fugiat velit animi cumque quis dolor. Consequuntur eius aut doloremque qui est rem deleniti ut. Nostrum nisi non ullam velit beatae fuga."
99,"2017-02-21 00:05:47.233","dale",18,5,"Neque magnam aliquam ab qui est aspernatur autem. Vel eius eligendi exercitationem voluptatem voluptas. Enim nulla et ratione voluptatem nisi. Non in consequatur voluptatum. Beatae dolorum qui quaerat atque."
100,"2018-02-19 09:40:51.384","joannie",18,4,"Incidunt totam perferendis et accusantium deserunt. Totam magnam aut ab veritatis aut aut. Perferendis ad aut ipsum qui rerum nihil. Non pariatur dolor enim voluptas fugiat natus itaque. Eum qui quia distinctio explicabo pariatur vel quam."
325,"2018-03-12 07:23:08.943","melvina-flatley",57,5,"Et praesentium ut placeat voluptatem odit fuga. Quaerat laboriosam nihil et animi amet ducimus. Sed ea id nihil est."
101,"2019-02-15 21:26:38.194","glenna.friesen",19,4,"Quia et ut quia veritatis officiis veritatis molestiae. Ipsam et vitae dolor accusantium aut sed. Exercitationem et quam qui amet ut veritatis voluptatem dolores. Ut maiores et cumque rem aut. Quia deserunt qui quasi nesciunt qui animi."
102,"2016-12-10 15:46:07.837","saul",19,3,"Nemo omnis dignissimos eligendi. Quod nesciunt dolorum sit incidunt ipsam. Reiciendis odio eius blanditiis nobis quia cum veritatis sapiente. Ad rerum quasi eum corrupti. Soluta asperiores vitae placeat ipsam suscipit odit minus."
103,"2019-02-11 07:32:34.363","viviane.torphy",19,5,"Delectus voluptas est a laudantium repudiandae. Enim at hic ex mollitia non sed atque officiis. Dolorum ullam et quae nihil sed aliquam cumque adipisci."
104,"2018-05-05 23:32:43.969","lucio-kuphal",19,5,"Ducimus debitis laudantium quae molestias. Corrupti dolor dicta omnis eius placeat. Sed dolorum inventore et. Expedita soluta ipsa eligendi nihil ea. Velit quae aut molestiae ipsum sit."
105,"2019-01-24 15:15:18.982","janessa.durgan",20,4,"Omnis maiores quisquam hic sint facere ad. Incidunt optio rerum incidunt doloremque. Maiores est nihil est voluptas exercitationem earum molestias. Quos voluptatem qui aperiam. Qui quis molestiae vitae et aut laboriosam aut dolores."
106,"2018-08-20 23:57:09.28","davin.marks",20,5,"Accusantium sit non ea dignissimos ut vero. Repudiandae quia eveniet consequatur ducimus. Laboriosam et quia dolore nihil mollitia voluptas amet. Dolores itaque praesentium fugiat possimus. Quo cum nesciunt et."
107,"2019-05-09 12:58:15.499","aditya.mills",20,4,"Porro nobis magni dolore omnis. Sint nam et ducimus earum necessitatibus itaque quia ut. Voluptatibus aut eum nemo provident accusamus deleniti culpa impedit. Voluptas eaque sunt necessitatibus totam accusamus nemo."
108,"2020-01-14 13:35:58.791","camryn-homenick",20,3,"Similique ut molestiae eligendi et placeat reiciendis sint. Quam quibusdam qui sapiente nostrum nam vel sed. Alias ut officiis molestias eaque dolorem necessitatibus."
109,"2019-11-11 03:47:13.31","markus",20,4,"Aut occaecati voluptatem est dolor est beatae. Consequatur error id omnis. Porro occaecati et voluptates unde. Qui officia sit deleniti omnis illo tenetur. Rerum occaecati est excepturi eaque sint explicabo quas ut."
110,"2018-12-01 07:57:48.65","myrl-tromp",20,4,"Facilis iure libero voluptatum enim temporibus quisquam laborum aut. Delectus voluptas incidunt dicta et rerum officiis. Veniam aperiam qui consequatur ipsum rerum. Et maxime veniam magnam. Molestiae magni voluptatum amet et autem fugiat."
111,"2019-10-07 20:24:12.718","antwon",21,4,"Dicta aut et sit dolores id. Eum non sed assumenda fugiat esse eveniet. Molestias fuga est repellendus sed rerum vel. Nobis eos et sit."
112,"2018-02-25 08:54:38.338","adella",21,4,"Et ullam debitis totam. Possimus voluptate ut sit vel quo natus fugit enim. Quasi doloremque ut ullam. Dolorem culpa dolor ut dolores."
113,"2018-12-24 14:48:04.023","bo-lebsack",21,4,"Dolores quo voluptatem enim sit quaerat laborum explicabo atque. Itaque eos neque aliquam qui. At et voluptatibus sed enim cupiditate. Consequatur sit sit eaque sed itaque ea fugiat ut. Et repellendus hic quas."
114,"2016-08-26 19:15:54.665","therese",21,5,"Est fuga ex amet corrupti aliquid earum. Necessitatibus est fugit harum voluptas. Iure consequatur tempore commodi."
115,"2017-11-21 09:46:48.796","isaac",21,4,"Laborum non commodi dolores qui perferendis voluptatem omnis quisquam. Dolorum et praesentium nulla saepe. Eaque sit dolorem ut laudantium consequatur nostrum autem."
116,"2016-10-12 02:57:20.935","alayna",21,4,"Qui omnis numquam quae quia. Ut voluptate modi praesentium. Aut reiciendis sit adipisci molestiae quia reprehenderit. Facilis ipsa consequatur commodi quia reprehenderit sint quae laboriosam."
117,"2017-12-02 19:42:42.974","frederic-osinski",22,5,"Sed est iste libero voluptatibus aut. Velit qui pariatur soluta vero ipsa aperiam. Est nihil enim vel sed explicabo labore rem. Sint ex repudiandae vitae eaque est. Autem architecto fuga inventore ad velit quae aperiam corporis."
